id_tweet,text_tweet,main_category
1037293366776672257,"ahahaha i think the mobi linux contain ha a weird dn struggl to get to alpin apk ind isol to the vm on hyper v so weird becaus it is just one machin it is happen on as much as i would like to walk thi down i might just reinstal docker on hi box",49
1037293528769093632,"texa do not play around the heat will get you sooner or later",49
1037294074687119361,"wonder if you do realiz that there are mission critic servic that are out becaus of thi did you ever conduct audit and took precaut distribut them guess not",015
1037294134833410049,"let us move beyond apolog and tri to make thi work ha been work for week i am just at a loss to understand thi with support move in second and minut but you are absolut motionless ツ",25
1037295311222394880,"i would have to walk that down can it not resolv intern or extern address",313
1037295694346964992,"it is weird seem to semi work i know it is the wrong name server just not total sure how it is got it just run the mobylinux ps1 again might have to walk it down becaus i bet it come back the same sure it is someth to do with the virtual switch",313
1037296546935726080,"vsts releas on host agent are veri sluggish they seem to hang on servic bu deploy from time to time",214
1037297417358585857,"what in etc resolv conf",317
1037298420279640065,"hi daniel can assist you further thank",25
1037298501523320832,"that is where the delta is nameserv is total differ from the host which is what i think the issu is what i can not figur out is where it is get the ip for the nameserv from",313
1037298616065576960,"is vs code extens back i need to set up a new instal",313
1037298923893866496,"love the proactiv support but thi is a total differ issu",01
1037299574203920384,"track id ddp8 1sg the issu ha not been solv yet we are still receiv intern error occur in process network profil of the vm fail to resiz virtual machin west europ",25
1037302805902417923,"what happend to sla",313
1037304120497991680,"can we know eta still some vm s are in fault state ms support team respons is standard one what they publish in azur statu now what happen to sla",313
1037304722061967360,"can ani one tell me how to recov file back up to azur recoveri vault situat backup wa creat from on prem server use azur backup server tri to recov it to a differ environ use azur recoveri agent aztechhelp",313
1037306058719485952,"issu are still not fix what is the eta now",211
1037307007815049216,"i back up file use azur backup server i m tri to recov file on to my laptop problem is i can not identifi what to select in the dropdown pleas see screenshot",13
1037307438117122048,"is it possibl to control access to azur sql server and azur storag tabl and blob store with azur applic gateway if not is there ani way to let onli servic of a specif subscript in azur gain access to these resourc thank in advanc",26
1037307875260096512,"azcommun my microsoft account wa perman suspend becaus i chang my password can you help me get into my azur resourc i need to pay my host bill",313
1037309091281027072,"azhelp hey i activ a free account and made my applic now my credit are zero and i can not recov all the progress i ve made is there a way to download my data",313
1037310207708356609,"thank for the fast repli i alreadi check the doc but there is noth releat to azur applic gateway so i assum it is not possibl with azur sql server but sinc allow traffic within azur is allow that is ok is there anyth similar for azur storag",26
1037310917397106689,"would you pleas address in a statu updat how or whi servic on other data center were so heavili affect what made the portal total unabl to see certain resourc",211
1037312098295009280,"so if i renew the subscript download the featur and interrupt it again will not it be charg to my credit card",313
1037312576223420416,"if you guy could pleas track how mani custom you have lost as a result of thi it would greatli be appreci i need to find humor in thi somehow",015
1037313381374599170,"thank you",01
1037313479462604800,"while thi is definit one of the worst outag a quick search show all of them have had outag affect avail here s hope they get it sort out today and can come up with a plan to keep thi from happen in the futur",25
1037313862003871744,"you can do it guy the forc you will use",24
1037314232499490817,"thank for the help",01
1037315210489548800,"uhm i wa eect an answer like look at thi guid on how eloit azur contain registri at the best have x time faster perform than public dockerhub",37
1037315832223817728,"aztechhelp i can not send new imag to the custom vision ai servic it lock on upload is there still a problem on thi servic",25
1037316026579468288,"could you pleas help me understand where i could report an issu about app servic authent featur i set up googl auth and want to receiv refresh token by request auth login googl access typefflin but there is no refresh token in store",313
1037316912299089920,"ani comment eta on the return of applic insight i m glad the statu page final figur out it wa down",211
1037317077307146241,"aztechhelp even after repeatedli link my subscript to my azur activ directori b2c the subscript doe not show up in my b2c directori i even tri creat a new b2c directori and link thing there but still no luck",25
1037317901907161094,"vm still can not be start we are sorri your virtual machin is unavail becaus becaus of connect loss to the remot disk",25
1037319829332606976,"ongo incid seem unrel as my function app is deploy to west europ also access token is there in token store so i guess all underli servic and storag work it seem that my issu is a normal oper",24
1037320048317214720,"i just promis one of our smaller custom that they will get free gr go forward assum microsoft will help us on thi for a small number of product system per each custom",012
1037321959988764672,"look forward to the discuss on next podcast move it to the cloud they said more resili they said thank for the imag",015
1037322283105304576,"ani idea when will be back onlin",211
1037322287454867457,"oh you bet our plan for the next episod record tomorrow out next tuesday chang quit a bit yesterday dumpsterfir",49
1037322969675177984,"current statu of portal",24
1037324348208627712,what,49
1037325569107537920,"azhelp just curiou how the outag in south central could impact a hybrid connector in us west",24
1037327199429382144,"still unabl to effect use custom vision servic today unabl to upload imag time out",25
1037328924513054720,"holi crap still jesu man hope you guy can fix it all quickli i imagin the stress and man poor peopl come on keep it up and keep go",015
1037330018542800899,"our page is back up thank",01
1037330277960441858,"sorri to add to the pile but the network in us north central is mess up servic bu relay down classic cloud servic not access from the internet etc seem to be an issu with the connect to the outsid world we are down",25
1037331471810355200,"who and how will they compens your client for be offlin for so long the promis of onlin wa not fulfil",24
1037331730833670144,"not a fan of uaa unavail as a servic",015
1037332093385236482,"get your crap togeth i m still have issu log into visual studio through the ide which allow for a connect to ms vsts how doe the cloud god reliabl guru not have redund and backup whatev the issu is let us hope a lesson is learn here",015
1037333643948113921,"fix azur",49
1037334801978728451,"receiv thousand of timeout sinc 08 2018",24
1037334982233128960,"thi ha been frustrat to no end but as frustrat as it is we final have some db servic come onlin and full applic access just a note for ani compani hope for good news we are test for consist now hour is just too long",015
1037337986931806209,"our applic server are work again but we can not start our databas server is the mainten still occur",25
1037339016629288961,"mcp transcript page is still unavail is thi relat with yesterday s outag",25
1037339678213660674,"no worri i see you guy have been busi with central us someon ha manag to resolv the issu for me now the updat is now on the forum post thank for your help",01
1037339877237551105,"we are down to just one vm that will not boot we also have a vm that will not let us connect via rdp but otherwis it is do it is job as a dc and authent user",25
1037339950625251330,"it is up it is down it is up it is down tri to be patient",24
1037340931148656640,"i hope you all had a tall frosti one onc thi wa fix yesterday could not have been a good day",01
1037341747905548290,"servic up and down realli damag",24
1037341925056172033,"it still not work i delet the project creat a new one but still lock on upload",25
1037342749647937536,"you will pay them for lesson in case they good or not it is weird",015
1037344699017818113,"had a similar issu with a vm an had to stop it dealloc and then start it in order to get it come back onlin it wa stuck in a start state",25
1037345490621194245,"if i wa as inept at my job as these idiot then i would be out of a job",015
1037345824798171136,"thank for the updat in the event servic have breach sla will custom be automat reimburs or do we need to initi the process ie log a ticket",015
1037346177677709313,"scale our azur databas in west europ from s4 to s6 is alreadi run for minut and it is onli on thi should not be take that long azur",24
1037346311870328832,"we upgrad firewal to accept onli tl amp and it somehow broke our connect to appinsight thought idea",25
1037351999921172480,"our instanc wa back up all thi morn until about minut ago at which point it went down again",25
1037352095190589440,"not sure what recoveri you are see but my servic in north central us are affect weird error on my ase the gateway did not receiv a respons from microsoft web within the specifi time period or there wa an uneect internalservererror",25
1037353282019254273,"could the outag in texa be affect appinsight",25
1037353553147383808,"exactli the same thing here but what realli get me mad is that there is no transpar inform about thi issu whi is my databas server vm the onli that still doe not work what about my data",211
1037354098192998400,"anyon liveblog on thi gt 24h to get the loss of one dc mitig sound like fun",211
1037354287498711040,"azhelp have issu with a server box accept it latest cumul updat have sever other on azur platform that have went a ok tri just about all of the standard step with rebuild updat compon etc ani idea",25
1037354676482654208,"i did a arepair on the vs machin that wa have the problem i believ that my project complain about not find a dotnet core version and it prompt me to instal it which i did without quit vs it usual say if it requir that it wa a problem after that",317
1037355110014304256,"i did a similar instal on the other machin but had a hunch it might be relat so i quit all vs relat activ then instal the dotnet updat no problem on that machin thi is twice thi ha happen on differ machin as to the becaus i m guess thank",24
1037355156080349184,"great support from azur as alway",01
1037356688377094144,"what is the best way to get support the interfac is so confus i have no idea what i am do",13
1037358099554873344,"did ani of the next updat will be provid by 00 utc sep or as event warrant happen alreadi",211
1037358145583034368,"i know you are not the eng work the problem but the lack of concret action inform is not help and make the team look evas i still can not authent with arm after gt h when will thi be fix and ye i have a sev a ticket open 118090518938695",015
1037359343140831233,"aztechhelp i know you are all busi w the south central issu but i have a qn one of my south central app servic came up but if i tri to deploy to the app servic i get thi error access to the path would home site wwwroot app offlin htm is deni",25
1037359611563700224,"yep veri frustrat",015
1037362143652458497,"most of our servic have been restor but we do have a hand of databas that are complet inaccess for gt hour now can not do anyth at all with them no restor no copi no ert no bueno critic ticket in",25
1037362454727221248,"like i said my app servic is current in south central so i am just go to tri after a few hour presum that thing are still not fulli function not sure what other option i have apart from tri a new instanc i do not want to tho",316
1037362572641624064,"still have web applic that can not function with integr ad authent and can not creat a web app in a new region in year of it i have never seen such a larg failur i m look to pull our k annual cloud comput budget to aws",015
1037363631095070720,"azhelp start thi morn and still on go vm in azur canada central datacent have connect problem to the sql servic as well as the azur file locat in the same datacent is there a known issu that would becaus thi",25
1037363833420087298,"we and my custom will be take our busi elsewher",310
1037363993445376001,"doe azur load balanc support session persist base on x forward for header as well scenario load balanc behind an app gateway cc",313
1037364321771302913,"how will they mitig our fine and penalti impos by our client",015
1037365569463484416,"veri veri frustrat money loss who will pay thi bill second hell day",015
1037365695154151424,"okay we are back onlin again",49
1037366238752768000,"they will not",49
1037366324782161920,"still batchservic and runbook not up yet do you have ani eta on these servic when will be up",211
1037366979223592962,"i can not imagin the amount of work microsoft team have had to do to stabil a whole data center kudo to et al team for their dilig in get servic up amp run again thank you",01
1037367997684477952,"now the statu site is also down",25
1037368560069169152,"thank you for your respons everyth it is work fine now my resourc are locat in south central us what wa the problem",01
1037369119887175680,"thank you for your respons now everyth it is work fine my resourc are locat in south central us what wa the problem",01
1037373343735971841,"hello can i add an agentpoolprofil to an ak my platform need to run x docker base on unix and one base on window in a kubernet cluster thank",313
1037374160182370305,"cool thank",01
1037374222304247808,"what about the cost we pay for the servic",015
1037375981990883329,"sorri we have a subscript with almost all our resourc in the south central region so we can not work yesterday so my question is i will pay for those servic",313
1037378058083229696,"azur insight stop collect data due to quota limit not sure how to increas the quota or resum to collect i tri to do it from usag and estim cost gt daili limit with no help",313
1037378176471707648,"hello i can access my databas and my app servic from the browser i have a problem is that i could not publish chang to my app servic when i publish an administr error some solut to thi problem error insuffici access to site folder",25
1037378613274963970,"is it anyway to publish in appservic vs error for credenti ftp can not connect and kudu doe not work",25
1037378767247822848,news,211
1037378972458397697,"thx it is ak not ac not sure about the differ i creat the cluster with az ak creat it seem the az cli doe not have the featur to updat an ak thu there is no featur to specifi the agentpoolprofil with creat",26
1037379188628627456,"are there other way to creat or updat ak could you point me to a doc pleas trough the portal i can not updat agentpoolprofil thank",211
1037380162940284930,"we are see sporad connect issu between servic in north central it is been go on all morn and is impact our custom noth show on the statu page though what is go on",211
1037381719320612870,"appreci you are probabl limit in what you person can provid but thi realli is not good enough that statu page ha not materi chang in or hour",24
1037382547569819650,"post request from multipl applic insight deploy in east us region to are return bad gateway result in no data from queri for my azur function log is thi a current known issu",25
1037384099399385088,"unsur i went to review log today and so far have not been abl to i wa on vacat for a bit up until yesterday so i realli do not know when it start",310
1037384649511784448,done,49
1037385682354929665,done,49
1037386964218077187,"thank you",01
1037386999118721026,"i am shock that i wa unabl to make chang to resourc in anoth countri due to arm be down in us south central",25
1037387324370444288,"inde we eect some money refund for thi epic disast",015
1037387723659784198,"aztechhelp delet rule from waf and now can not delet listen tri ps but no luck seem like a terribl bug ani tip",25
1037387820258783233,"i hope we get an in depth postmortem like the vsts provid exampl",211
1037390068208599046,"ye the portal interfac and ps do not let me delet the listen the error say the listen is referenc by a delet rule",25
1037390620518576128,"thank you it look like that there are still problem with azur southcentralregion do you have a timelin when the servic will be fulli restor",211
1037390628202708992,"more cloud problem today see thi in our tenant as well user on vdi first to complain not sure if we have ani exchangeonlin ticket yet office365 azuread",015
1037391535631998981,"thi doc is for upgrad kubernet version not updat an exist kubernet cluster sorri but thi doe not answer my request",211
1037391714850365442,"utc updat i see the statu page is have issu again",24
1037391719153762304,"we need more transpar regard region depend all of my resourc are supposedli in west us and yet still impact",211
1037393405461110785,"ye it is for an applic gateway",313
1037393473165512704,"you may have notic some difficulti access dvsport yesterday and continu today access to our dvsport platform is still eerienc problem due to microsoft azur cloud servic caus by sever weather linger effect are be work through",25
1037393886551785472,"are you have problem with your central india server as well my databas ha been inaccess for the last hour",25
1037394067406180353,"can you give us an email where we can provid you thi inform",313
1037394750788251648,"o365 user with outlook are now get pop up s that just say throttl now",25
1037395251223134208,"we are investig",316
1037395716736344064,"ani updat portal still down arizona",25
1037395831396151302,"correct i want to updat an exist ak cluster to add an ostyp window agentpoolprofil",313
1037395928838111232,"someth from icymi",49
1037396351892574208,"anyon els continu to have applic insight issu for east us statu page show up when it show anyth but all we get are error retriev",25
1037396617698140160,"see a nice time new roman messag on authent on office365 outlook for some user just say throttl guess you are still have some issu over there",25
1037397626751262721,"get throttl here also throttleg",25
1037397811401244672,"all my user get the offic throttl messag fun day after yesterday s azur outag might be time to take the phone off the hook and bust out a classic",25
1037398268215537670,"thi is not an offic specif issu get thi with multipl app which reli on azuread authent",25
1037398273617813504,"if you are go to re post the same updat everi hour you can at least chang the text to the correct time that you are post it",24
1037399481820569600,"what a day",49
1037399507145654272,"i have applic insight in west us and it is not retriev data or ha data miss",25
1037401575873019905,"ani updat of when the problem are go to be resolv still get the black cloud",25
1037401722119905280,"i recent upload a site to static websit host in azur storag my boss io browser are get frequent s when open up link to the site android chrome work android ff mess up onc but is now work ani idea",25
1037403861928030208,"our end user are get a messag throttl when tri to open the outlook applic",25
1037404372924354566,"there is an offici issu on office365 health page with exchang onlin",25
1037406164978475013,"just start get error messag start outlook client ask for password then pop up a messag that onli say throttl webmail still work mani other have the issu per googl search is thi relat to yesterday outag",25
1037406461666709506,"honestli i feel a bit mix about like that tweet",015
1037407904280784896,"not sure if it is a bug vm fail to start after sever attempt state that we do not have suffici capac for request vm size by the way it happen dure restart",25
1037409295720218625,"azhelp i am have problem set a vpn with ipsec in an ubuntu vm use strongswan packag how should i configur the virtual network to allow thi type of conn",313
1037409637807677440,"have you tri resiz the vm",317
1037409961767313408,"there it is thank a lot",01
1037410234485104641,"live feed from ms datacentr at time of incid",49
1037410485308743682,"everyth went back up for us as of 30 cst but now the site and authent are down and there no materi updat from twitter or the statu page love",211
1037411603841466368,thank,01
1037412229363036160,"hi i know your busi quick question will the appinsight west us take a while to catch up some stop at am yesterday utc but now show they stop at pm utc yesterday so seem to be catch up and noth sinc",313
1037412377032097793,"thank you found the answer through anoth channel",01
1037412411433570304,"kudo to jose c on for a veri detail elan of the issu and our intern public cloud team that quickli arriv at the same conclus even while deal with a massiv region failur alway happi to find a simpl elan to mind boggl issu",01
1037415011918827520,"hour do you have the work eerienc guy on thi",015
1037415137236451329,"thank you for your understand daniel all should be work well now",01
1037416473331949568,"aztechhelp our web applicationg is suddenli veri slow yesterday wa fine but today is terribl we did not publish anyth",214
1037417273894612992,"i m get notif of my site go up and down again like they were last night are we have more issu",24
1037418284608618496,"aztechhelp my app servic certif is stuck in pend issuanc when i click on perform requir domain verif it goe to the certif statu and never load that view",25
1037419000362397698,"ye it is",316
1037419700181843969,"not sure how the quota limit work for insight if someon can help me with that",313
1037420031590715392,"my user keep complain about the azur outag i keep elain to them it is not a big deal becaus the azur statu page onli show a warn condit i do wonder what an actual error would look like though",25
1037420865120600064,"i would say no azur load balanc oper on tcp and udp layer though it can perform http health probe and the header is http applic layer",316
1037424478219845634,"we came back up last night but are down again now and error",25
1037429055425933312,"ye we are awar that there is an issu it is all tie to the us south central outag the team is post inform here sorri i can not provid ani better info for you",25
1037429100900540417,"ye we are awar that there is an issu it is all tie to the us south central outag the team is post inform here sorri i can not provid ani better info for you",313
1037429728188276736,"aztechhelp network secur log via network watcher look for allow and drop packet",313
1037432203192528896,"is there a smarter way to do thi with logic app i have multipl twitter account and want to tweet to a specif account with one http request accountnam tweet to logic app",313
1037434309773279232,"i will be so happi when azur is complet up and run again",012
1037436097033265152,"same here incred frustrat",015
1037436186023919616,"the statu page you keep refer peopl to is worthless it ha list applic insight as good sinc am ct and i am still not abl to execut ani queri",015
1037436255376756736,"thank you for your answer now it look good",01
1037436960405680129,"thank i did not know about that page",01
1037438383495229440,"azhelp there is a charg on my credit card from azur msft that doe not match ani of my subscript",313
1037438694268039168,"our servic came back late last night and now we have been down again for the past hour and a half the latest updat say we should be continu to see improv we are see the opposit what is happen",214
1037439050930696192,"anyon els have problem with ftp to app servic i reset my publish profil and the new password doe not work either",25
1037440929731407876,"i have a build definit in vsts that ha been run for month which perform an ftp deploy step as part of my ci cd pipelin it ha not work sinc the outag even after i reset the publish profil and updat the build def with the new password",25
1037443104343777280,done,49
1037443110182285329,"my app is still down thi is just beyond frustrat it is been up but it come back down again we can not work like thi pleas when can we eect thi nightmar to be over",015
1037444883265581065,"ye same for us with a coupl of app",316
1037446157402820613,"look like thing are not respond when it come to git thought",25
1037448557580771329,"my servic issu dashboard still list my three storag resourc as impact is there a time frame yet as to when these will be restor",211
1037448830025953280,"i m have an issu on an web app host in an app servic that can not write to the local file system the quota blade list kb of space consum is thi part of the storag recoveri",25
1037449094464122883,"azhelp who can assist me with login i am the enterpris admin howev it display my account it invalid and your support portal doe not render pleas advis on fix",25
1037449888286564357,"sent thank talk to ya soon",49
1037450951076982785,"the app insight team is post their own updat here",49
1037451610643984385,"hello i can access my databas and my app servic from the browser i have a problem is that i could not publish chang to my app servic when i publish an administr error some solut to thi problem error insuffici access to site folder",25
1037452599719546886,"no clue where that is but you guy are throw s on anyth git relat such as pull request",37
1037453446490804233,"you are both tag",49
