id_tweet,text_tweet,main_category
1046126318717464576,"instead of purchas a new physic laptop for consum i m look at an azur vm pay for an ondemand vm desktop is there an roi doc for comparison of new physic laptop vers an window desktop vm",211
1046126554491867136,"aztechhelp is there a way to achiev consist a better latenc between netherland and tokyo",214
1046146414714056709,"azhelp if i purchas a certif dure my free trial and it use part of the free trial resourc will i be bill after ask for a friend",313
1046147073538760707,"server are good now can we just get thi done and hand me my l",316
1046148992025993223,"lol luke",49
1046149222742069249,"when you get a notif in the pub that you instanc ha gone down and you can re imag after a few pint that just happen truestori",25
1046149922767163393,"nope all sort ish",316
1046172472125673475,"the ping is like ms and async short text messag is like to sec away i would like to see less network jitter or use some kind of dedic network infrastructur or rout for constant time like sub sec messag would be nice",24
1046175872527536137,"i do not know if i get it right but look like azur ad is realli cheap did i see right",13
1046181668166529024,"i have read the document it add up anoth layer of encrypt not need but i am not sure thought if it help with latenc from netherland azur network to tokyo third parti unless microsoft netherland backbon network have a straight fiber optic to tokyo asia",214
1046182397514010625,"i am not sure nor an eert but cloudflare have a product call argo that might be good fit for my use case until i test it",37
1046187272826245122,"hey after you requir chang for ipssl and the reassign of ssl certif my web app ha stop work first onli sometim it return a error now there is everi time a error if i debug the app non of my code run",25
1046191378882072577,"hey br i did follow the guid as in the mail ive got from the support team initi i had an sni base ssl and i reassign the bind that had caus all the troubl initi and as portal doe not detect a downtim i am also not abl to open a support ticket 1",25
1046191513229807616,"i did what i wa told in the document but now noth work anymor 2",25
1046213015325085697,"hello can you help me reset my student account password i misus safari auto fill my password for azur account and i now can not login or reset password for azur",313
1046215916344791040,"normal safari will auto fill password for my azur when i login two day ago i reset my password with new password which is offer by safari you know like some random combin like acb9 edr3 like thi when i log in again it still fill old password",37
1046216341986967552,"and i wa too trust the appl to rememb the auto gener password and when i tri to reset it i got thi inform",37
1046218722430656513,"azhelp hello i want to know the free account whi the credit card charg",313
1046230397305028608,"hi wa look to sign up for azur tonight 12 mo free servic etc and i have not been abl to get past thi part of the process for the last hour or two load anim loop with noth alreadi verifi my email phone",25
1046231759929708544,"i went to a privat browser no luck then disabl ublock origin and ghosteri extens which seem to be do the trick appreci it",317
1046284912800731136,"my issu is evalu month is not enough where other lead cloud provid are give month to year time to look then month is less i m not have issu for credit you keep same amount but pl increas time for interest peopl azurestack",25
1046310026955182080,"thank you for your support",01
1046385069642768384,"cloud infrastructur checklist",37
1046385481749917696,"non function requir s w dev checklist",37
1046414869594091521,"doe azur function signalr support multi tenant see my question here",313
1046415199413170177,"aztechhelp hi i can not delet a resourc group which wa tie to log analyt it hang and then fail i also can not delet microsoft insight scheduledqueryrul which is tie to it pleas assist thx",25
1046416206008373248,"well the resourc the insight wa monitor is gone so it can not delet the rule and henc the rg can not be delet even when forc is use",25
1046417956710871042,"ani thought",49
1046419565914337280,"yea doe not do anyth thi is veri problemat ani other thought",25
1046419976977076224,"i can not even disabl the rule thi whole subsect appear to be stuck as of right now for me",25
1046421036143652869,done,49
1046422136846536704,"done i dm would it to you",49
1046440701582553088,"i ve got two support ticket open sev b no updat in over a week sev c creep toward a sev b no updat sinc wednesday premier support is not feel too premier",49
1046443402286571520,"aztechhelp bad request move app servic to suscript code resourcemoveprovidervalidationfail detail target microsoft insight compon messag code badrequest messag bad request innererror diagnosticcontext",25
1046454230708617218,"on wednesday and now current is respond our servic are not avail right now i m tri to follow the tutori and my trial is onli enabl for the west region is the servic realli down for day",25
1046454233158037504,"solut had to regist microsoft comput on the sourc subscript but i have regist and same error bad request aztechhelp",25
1046456908503306240,"curiou if you click and got the same error messag lt h2 gtur servic are not avail right now lt h2 gt lt gt we are work to restor all servic as soon as possibl pleas check back soon lt p gt ref a a1d6a18517a24841b03bf45315bdc0cb ref b miaedge0510",25
1046458055209177094,"thank you",01
1046481469642805248,"azhelp need to updat bill detail but the add a payment method screen time out need to updat detail by midnight septemb",25
1046490390013063168,"it is a good practic if i move my spa static frontend to azur file storag and onli deploy all the backend microservic to azur servic fabric cluster and what are the benefit for thi separ",13
1046494675014701056,"doe anyon know how long it take for an domain purchas to go through i have the dn zone in my resourc but not the azur domain",313
1046501661840015360,"need to talk to your sale team in india is there a number which i can call",313
1046503545506336770,"is it possibl to reach a postgr db from a vm run cento on the same resourc group i get a respons from outsid the group but not from insid",26
1046534390006927361,"hey can you pleas check your dm i need some help with student and pay as you go subscript",49
1046535620590481413,"can we move thi to dm",49
1046585664643325952,"aztechhelp i am unabl to connect my databas in azur local howev i have configur my ip and everyth as rule can you pleas let me know what to do to overcom thi tia",25
1046612689764605952,"is it standard that azur preview featur are not avail in the portal is the onli way to access azur privat dn via cli azur",26
1046613929479172096,"awesom thank",01
1046614964167880704,"thi number never get connect i tri thi today as well as sever time in the last week at variou time in the day it never ring",317
1046616878876102657,"it doe not go ahead",49
1046619865954619392,"oh that wa my cach issu thx",01
1046623489690673152,"hi azur ssa cube refresh continu fail pleas tell me what is the problem so mouch memori is there",25
1046652309172674561,"aztechhelp i can not creat vm acceler network on ubuntu vm",25
1046666485165244416,"i would say open an ticket",37
1046669461263134721,"aztechhelp is there anyth wrong with the azur databas for postgr blade i m tri to add an ip to the known host but the ui just hang",13
1046689786566725632,"azhelp hi how can i sell my websit content dn from microsoft azur note custom from my countri or other countri thank you",313
1046697469055299585,"seem to work ok in chrome origin screenshot wa from edg thank you",49
1046713562029338624,"ye that work great thank load",01
1046716080088076288,"thank it actual just start work in edg without clear my cach although i m now see slow perform in both browser",214
1046716299483770880,"aztechhelp tri to get access to a vault follow corrupt of a server will re regist give me access to past backup",313
1046722393367085056,"hi tom our friend can connect you with the appropri resourc for that case thank",316
1046729618848456706,"whi can not i accept thi invit",313
1046731949400879105,"thank for your repli link here",01
1046734665833467904,"i m tri to regist a new organ account turn out my phone wa not properli connect to the network when tri to get verif code so after a few attempt i just keep get kick out with thi messag what do",317
1046735817551556608,"i m not realli sure i understand the question i m tri to sign up for a new organ account for the azur portal access start at afterward i will set up a subscript",313
1046736417798410240,"i got that screen dure thi",49
1046745637990137856,"hey how do i delet an azur ad tennant forev",313
1046747348087574528,"also interest in thi one got creat for the domain associ with my azur account and i ve never use it keen to delet and stick with my msa that use that custom domain name",37
1046747774832783360,"just becaus i need thi for the same reason",49
1046748152353689600,"i ve tri and follow all all subscript delet and it still say to delet them it say fulli delet in day need it gone now",316
1046754654791651328,"is it possibl to add an aad group to a role and administr role or is it user onli",26
1046755489068056577,thank,01
1046755876588199936,"azhelp is there a polici that can be use to keep employe from use their email after hour thank",313
1046757055971897346,"we use a combin office365 intun and azur and want to have it cross platform whether it be on their mobil or a surfac",37
1046759093413777408,"i m current research if our bi solut is abl to be transfer to azur current look into use insert into into mssql databas as a store proc am i abl to use insert into cross databas querri when im use a sql manag instanc on azur",26
1046761012932890624,"consid it done thank",01
1046764590858735622,"i may be miss interpret the articl but it say that thi featur is includ in all offic subscript but within azur it say i need the premium p2 suit should i be access thi through the admin portal for office365 thank again",01
1046765412459958273,"thank i will have a look",01
1046765889734021120,"just had a quick look through and i will tri it shortli onli question is that thi look like it is set iam role to group user will it work for azuread role",313
1046769584102158338,"great news thank",01
1046771577914683393,"use your logic app salesforc connector which work great when i m listen to asset creat modifi but when i tri to listen to account creat i get veri inconsist result sometim it catch them sometim it doe not is thi broken aztechhelp",37
1046773357809610752,done,49
1046773599770742784,"aztechhelp the os disk for a window vm fluctuat greatli when the user login into the server use rdp there will be gb of storag avail a few week later there will onli be gb avail",25
1046776727664513024,"will do thank",01
1046777771291217920,"the os disk for a window vm fluctuat greatli when the user login into the server use rdp there will be gb of storag avail a few week later there will onli be gb avail",25
1046792603230920707,"thank you i will do i do like azur",01
1046799767362326528,"awesom thank again",01
1046810435155050496,"thank for the respons here you go",01
1046815740010135552,"aztechhelp how do i submit a request to unblock tcp 25 without a paid support plan",313
1046817342427189248,"to note i have mang to delet everyth requir except my subscript i have mark that for delet and there is a cool off period of day then i should be abl to delet my azur ad account phew",316
1046817532236255234,"but how do i stop someon from ever creat anoth azur ad that interfer with my msa",313
1046824688855535616,"hi kristof should be abl to help you",316
1046824853142196224,"hi i m tri to creat a reserv instanc for an exist vm base on rec by the azur tool and it say that is not avail for my subscript region what can i do is creat a new subscript in a differ region possibl",26
1046827451282788352,"so sorri to hear that ian should be abl to help you out",316
1046833886355968001,"aztechhelp we have multipl subscript in our directori i am tri to set up site recoveri for one of them but it is not avail in the sourc subscript drop down other are though ani thought as to whi it not there",49
1046836670807650308,"i just sent the dm with the subscript id thank you",49
1046839855945338880,"i m tri to find a vm to use for vsts and it seem you have none that a known thing check sever us data center",313
1046840359941226496,"aztechhelp unabl to delet the recoveri servic vault error unregist the follow contain abc howev there is no such contain in recoveri servic vault pl help",25
1046842391813140486,"post creat",49
1046856610176479232,"creat new user in aad make global admin log out log in as new user delet all other user from aad log out request password reset for new user never log in again aad with lock out account will be clean up after month",317
1046856851583848448,"aad will surviv subscript self destruct at least that is what ive been told an aad is a subscriptionless resourc",317
1046857141154394113,"hi kevin so we can better guid you pleas provid us with more detail about what you are tri to accomplish feel free to reach out to us via dm if need",49
1046861239580811264,"you can not delet an aad without first delet the subscript say so right in the check that are run befor delet i have to wait day and then delet aad",317
1046861454731825154,"there is a delet button now much easer",317
1046876060774731778,"good to know the previou mechan took month and wa insan",24
1046881671801393153,"ha anyon had issu connect to your cloud servic portal iaa etc or even office365 from greec it seem you were not reachabl for about minut a half hour ago",25
1046882721878949890,"not happen ani more it last for minut between 28 to 33 utc 3 the issu look like all of your infrastructur wa not reachabl connect time out tri to reach you",25
1046890364127318016,"still have problem delet user programat in azur b2c use graph api pleas see follow question and answer and my final respons which highlight my issu",313
1046927494551613440,"sorri for the late respons keith in thi case we recommend reach out to our team if you need assist with anyth els pleas let us know",316
1046929784075378689,"is it possibl to migrat classic to arm use cloud she will these command are not all avail in the cloud she will",26
1046932315761463296,"i will creat a new post on thi tomorrow to be clear thi is not someth that is broken or that i have ani object withj how it is deploy i am look for a stop gap solut for the team as we come up with better solut thank you",313
1046953257267019776,"ye that did help i think i can figur out the rest for my scenario given that post",316
1046954066411053057,"aztechhelp i can not creat an ssi runtim with error error code customsetupscriptnotfound",25
1046981707939950592,"checkout thi sneak peak at the present i did at ignit with the azur backup amp site recoveri team ignit cloud backup arm tempalt msignit",49
1046981787862347776,"checkout thi sneak peak at the present i did at ignit with the azur backup amp site recoveri team ignit cloud backup arm tempalt msignit",49
1046991733077286914,"i honestli do no rememb exactli but sinc then we are use a premium servic bu namespac without troubl i rememb that i could creat one in anoth region",12
1046999995822551040,"set your calendar for twitter ama with the azur function team functionsama azur function devop azuredevop via and",49
1047007445959229443,"aztechhelp i m have troubl re enabl sql server autom backup on azurevm run window server articl outlin my exact problem as eerienc by anoth user",25
1047016035390578688,"thank i will test the powershel method and let you know if that did the trick howev i think it is worth look into whi re enabl via the portal is not work",25
1047030458725388290,"powershel command also look to return the same result origin return statu of true and complet success but when check the set it is still not setup what is next",313
1047033349452259328,"aztechhelp i have visual studio enterpris subscript and i happen to creat a directori with the name raghu in directori everi time i go an click the left panel azur activ directori thi show a default directori how to view the one creat earlier",313
1047033706593099776,"aztechhelp i have visual studio enterpris subscript and i happen to creat a directori with the name raghu in directori everi time i go an click the left panel azur activ directori thi show a default directori now i am not abl to find my directori",313
1047034390239465474,"whi can not i transfer resourc from a disabl subscript i do not want to add a credit card and get charg just to transfer resourc out of a subscript",26
1047036676000964613,"thank for the help thu far here is the question link",313
1047042105812688896,"azhelp my azur for student subscript disabl becaus i have reach my credit limit and i creat a pay as you go subscript but i could not move my resourc pleas help me",313
1047052314891169792,"aztechhelp though i unlock an app servic domain delet domain is disabl in office365 domain manag i can not delet the domain over azur portal neither due to an error say that it is lock can someon pleas guid how to delet a domain in azur",25
1047058566522245120,"appear that you have to disabl preview featur i guess the composit model",317
1047061124913516544,"not tri that yet will give it a shot",316
1047062088353505282,"unfortun get similar result on a separ g connect as well",317
1047074383771197440,thank,01
1047076842421854209,"azur portal ha been go real slow for the past coupl of day noth on azur statu page anyth go on",214
1047078937543741445,"i am also find thi issu have submit a ticket",49
1047082220970790918,"how can i open smtp to the internet use for a project",313
1047082535598116865,"azhelp appservic can you suggest how to avoid err when upload bigger file current eerienc issu for gb file even set webjob idl timeout ms in the az panel scm command idl timeout websit scm idl timeout in minut",25
1047083742857240576,"refer to thi document i can not use smtp anymor port to send mail becaus azur forc tl but my exchang server on azur must use smtp 25",211
1047087187429351424,"thank you do i need to open the ticket or have you guy alreadi done that",01
1047091211180363777,"lt requestfilt gt lt requestlimit maxallowedcontentlength 4294967295 gt lt requestfilt gt lt aspnetcor requesttimeout 01 00 00 thi is my current config such file are be save in a remot storag by chunk of mb it take a lot of time befor get er500",316
1047096886266454016,"aztechhelp nodejs server on iisnod not launch at all caus http respons server run fine from insid diagnost consol cmd env but url access caus http error what give",25
1047100998638956544,"i would like to know what is the default storag given on ftp",313
1047105003226370049,"aztechhelp how do gener crash report for my virtual machin i ve thi messag err network chang err network chang",313
1047105052723302401,"ye i did assign a custom domain name the websit is up and run and can be access through thi name",316
1047105350451847169,"did you receiv my answer i m not to familiar with twitter",37
1047107199267270657,"thank for the prompt repli sorri for the mislead question allow me rephras my question as below what is total storag amount given by azur server where the subscript is under free tier",313
1047107298806718464,"just did that thank",313
1047109822292926465,"confirm via screenshar someth s wrong e g app list take a minut to load i need to roll thi out to the offic but can not with that much of a delay they said keep an eye on it and they will check back later ツ",25
1047110017927794689,"made the same step and wait approx hour still noth",25
1047112924513341441,"oh okay i wa search my respons underneath your messag strang when you write someth and it s not appear somewher directli visibl",25
1047113428870078464,"okay thank you",01
1047114081029828609,"hi i want to signup azur free account but for the credit card verif i got charg but my verif fail so how",313
1047115434774933511,"they do not seem particularli help as it is been hour and i ve still not gotten ani help from them to sign up for the new azur account i did figur out it wa simpli that the phone number end up get blacklist becaus of failur as with anoth number it work",015
1047116964840316933,"doh it wa as simpl as clear my browser storag thank for the speed and use respons",01
1047117036894269440,"i have a sever b case under no answer in the last hs the phone as prefer contact method one call no solut answer question by email can you follow up fail badsupport nosupport",25
1047117204083396609,"okay well none of the topic in the list of common problem ha someth to do with my issu pleas check the pictur i attach the frontend just look complet differ and offer other option then the step in the guid on the rd pictur you see the certif",25
1047120156223143938,"thank i found what i need",01
1047120280253095936,"thank you i will wait for a respons from",01
1047122736571650049,"hi portal seem realli slow particularli with list app registr in azur ad 2 minut to list them there is onli i ve tri clear cach etc and use privat mode as well as edg and chrome",214
1047124966502752258,done,49
1047126214132011009,"aztechhelp hello azur i m a student and current can not creat a databas for my school project how to proceed",25
1047132422918344705,"i am see the same ie slow and some categori in aad are grey out",214
1047146194273808385,"here the link to the new post",49
1047166821978333184,"we would recommend reach out",49
1047167129315885056,thank,01
1047170709255069696,"hi christian should be abl to help you out",316
1047172695069220874,"can i get the sever on ticket updat",49
1047175665609527296,"one step forward and two step back thestoryofmylif got my adf work just fine new trial azur account readi to rock and now the licens will not work i am just tri to get on top of the new kickass msignit passwordless and window hello stuff",313
1047185821315387392,"hi support sinc we sign up we have onli use support request to report bug and outag in azur product is thi how it is intend to be use in other word is thi a servic where we are just pay for the privileg to let azur know when stuff is broken",313
1047191011938783234,"hi vladimir our friend should be abl to help",316
1047200321330712576,"how can we autoscal our node in ak is it possibl",26
1047205916351889412,"thank for the link we want to autoscal node base on storag queue doe abov link work for thi scenario recommend",313
1047217296010305536,"where can we found plan mainten window for eress rout pleas",313
1047223841691508736,"hey sent you a privat messag with my subscript id",49
1047227272472621056,"cc s pose you all are also parti to thi phish campaign",49
1047228807839723520,"should be ok thi time",49
1047232971307139072,"i do not understand health histori statu is show histori data where i m search for incom event",313
1047234116394131456,"hello dear team we are tri to chang a templat of a connect factori dashboard given as an exampl to do thi we need an access to the code on a linux vm of azur through powershel is it just one way could you give ani link or exampl of thi",313
1047236728036188161,"hey ani problem with your ticket system becaus it seem broken and i can not submit a ticket about the fact that someth els seem broken",49
1047239656792887298,"each time i tri to use microsoft learn the sandbox give me thi",25
1047239665923837953,done,49
1047240146381414401,"you tri an incognito window",316
1047241725029306368,"can not see it where should it be",49
1047241990667210753,yeah,49
1047242611759755264,"cmon where is the fun in that play where is walli",49
1047250788874113024,"you use microsoft of work account",316
1047251861693186055,"microsoft account i will tri it again tomorrow but now tri time and it is work onc",316
1047252201356361728,"interest i figur out main problem i had wa when use microsoft account and also sign in on other tab to work account seem to fall apart so new browser no work account",317
1047252349469818881,"ok i will tri that tomorrow thank you",01
1047257999436214272,"thank ani option",01
1047265694306500609,"hey so need updat as the articl promis it would be be to reflect that azur ad connect 80 0 and newer presum wa releas to address the issu with net in august",25
1047289778243137536,"applic gateway will not delet lt uuid gt wayworkitem could not be found and or creat ui just say fail",13
1047290874722283520,"can i dm you the screenshot sinc it ha sub id and etc",49
1047312417586405376,"did you tri edg",316
1047328498942017538,"hi aztechhelp i have a problem where some vm are not avail thru my azur subscript could you suggest a tip or help to fix thi",25
1047365037348802560,"great thank",01
1047370420679331840,"microsoft azur suffer outag after cool issu azur cloudcomput cloud microsoft",25
1047380123761217536,"aztechhelp simpl file copi activ from one folder in datalak to anoth folder in same datalak fail where to see exact error messag",25
1047390689049436160,"aztechhelp az webapp deploy sourc config local git doe not return correct url the port number is miss return valu should be",211
1047391920333475840,"aztechhelp pleas help az webapp deploy sourc config local git doe not report correct url the port number is miss return should return",211
1047413583871504385,"we are use azur cloud we need to delic the resourc to other account plz suggest us pre requiesit and step need to perform",313
1047415637784506368,"we have an account that is person account now we want to add other administr from other domain could you pleas help us to add user as administr or can abl to chang the email id",313
1047416781927641089,"no we are not",49
