id_tweet,text_tweet,main_category
1039219947342163969,"correct it is veri easi to figur out should not requir me to right an essay with screenshot which their develop team alreadi know and will not be possibl to work on that in near futur",015
1039222624918822913,"i just did",316
1039224173137199104,"aztechhelp i have multipl azur account attach to my lanc com email use to be abl to switch directori from one to the other in the can not do that anymor for some reason fyi i m a microsoft mvp",26
1039236413374386176,"do not do thi",316
1039244246686097408,"can you help me",313
1039246900984143872,"tauan can you tell us more about what you are see feel free to dm us with detail if you like jb",49
1039247933579976704,"i open visual studio i click on team elor gt manag connect gt connect to a project i login with my account and no project is display i access via browser and it work normal",13
1039254183403311106,"what would you find gregor is it anyth that can help with",316
1039255306067501056,"hi thoma sorri to hear that should be abl to help you out",316
1039257137120194561,"when valid arm templat you can have a space at the start of the name and it valid fine but go to deploy and you get an error i did not think valid should pass tbh",25
1039257513466712065,"what is with the mitig statu i m still unabl to get ani result from the unifi audit log via ps command or secur amp complianc center audit search i get no result either way",25
1039259629761454080,"again today i m see similar storag and perform issu in southcentr us as last week still no respons to support ticket can you pleas advis",25
1039267597399744512,"azurestack your storag elor tool is kill my gpu i just report it",015
1039269511785000960,"is there an offici statement on what is do to address the cascad widespread long last issu result from the sever weather event last week azur azuredown",25
1039280555257421824,"hey ani thought on thi ticket",313
1039284158848266241,"thi post i wa ask to post in the forum onlin",316
1039294449401167873,"sorri to hear about that our friend should be abl to help",316
1039318600694157312,"when will autom releas to azur function from github be avail in azur govern",211
1039330803606585344,"our ac url are no longer resolv i thought we had until novemb to transit off",25
1039333139703783424,"hey azur can someon clarifi how much it cost to have privat repo use azur repo there is no mention of privat repo in the price guid cc",211
1039333260059439106,"will dm with detail",49
1039364603426131969,"ani updat",211
1039373787647492098,"the issu are resolv thank",01
1039376281089933312,"ye that is the same web page i wa look at no mention of privat repo",316
1039387787475091457,"azhelp i do not see b seri vm size for certain vm other i do whi is that",13
1039390145542348800,"aztechhelp i m have troubl log into my vm remot desktop connect an authent error ha occur the function request is not support remot comput thi could be due to credssp encrypt oracl remedi",25
1039395547663065088,"what is that could not understand properli",316
1039396273361702914,"the through put mention in the vm sku s is for iop not for nic data transfer throughput",317
1039396968336896001,"i m have a discuss here and can not find the answer i m sure you can help what wa the launch date of the west europ region of azur thank",211
1039396999416635393,"azhelp hello we have web app and today an error occur http request do not pass but http request pass normal yesterday there wa not that mistak whi could thi happen",25
1039397370465644546,westu,49
1039399545489174528,"aztechhelp the ip address wa chang when the virtual machin wa reboot becaus the spend limit wa exceed is there a way to specifi it as a previou ip address",313
1039403307092066304,"dave azur can i check i ve got the right idea to use the c signalr client tweet abov but with azur signalr i should gener a connectiontoken from my azur signalr accesskey use jet and uribuild then send that with the hub connect as part of the querystr",313
1039403772013768704,"still have not heard back as to whi you made it so much harder to switch subscript in the azur portal",015
1039405177009201152,"thi part the directori switcher is not there ani more",26
1039413232841224192,"hi we are eerienc ftp connect issu when deploy our function multipl environ are there known issu with the ftp right now",25
1039414435197071363,"hey i wa abl to make modul that will enabl multipl blob download zip format use node if thi modul is worth contribut where should i contribut",313
1039421661597061120,"aztechhelp hi i have my domain name and my server host by azur i am tri to find where i can creat email address with my domain name insid ex me com can you help me out",313
1039422851315625984,"azhelp i am get an error on the wordpress azur app help me how do i resolv thi",25
1039424013766930432,"do you not see the follow the icon highlight in yellow",214
1039424417867149313,"now what azhelp",49
1039428144023957504,"back up vm use manag disk with backup stack v2 will it actual cost me ani more than use the origin backup stack it is not clear from the document thank azur azuredevop",211
1039431886324555776,"ye onli log in to see what it can do today",49
1039433740227944448,"where is the subscript if locat",313
1039434355460980736,"thank guy",01
1039443445616504833,"oh when did they move it",13
1039443851889586176,"certainli within the last week i would say i have multipl subscript so use to use the old way all the time",316
1039444600556072960,"hello i have an issu with a vm with a data share on it it is link with a s2 vpn with the on premis the share folder work fine for some hour and suddendli it stop work not possibl to acc the map drive anymor for a while",25
1039446463716229120,"not realli just a messag tell that the map drive is not avail",25
1039446684454010880,"after some restart the vm ad file server i can access it but veri slow and again i have a timeout",214
1039446956081213441,"aztechhelp hi team is it possibl to enabl auto scale on azur hdinsight if so can you pl point me to it document",26
1039448106256015361,"no loadbalanc for azur bu gt intern server error the server did not provid a meaning repli thi might be caus by a prematur session shutdown trackingid 1e06e527 6378 405f aef0 ad11a6d3ca21 timestamp 9 11 2018 34 19 am",25
1039449356040994816,"hi thi is about manual scale i am ask for autosc base on the cluster load is it possibl",313
1039450219912540160,"ok but i m new to tweeter so how do i send a direct messag",313
1039452732669743104,"the move it a few icon to the left",13
1039457174223839233,"aztechhelp hey i bought a custom domain app servic domain and the deploy fail with an internalservererror now it is neither associ with my app servic nor avail to re buy how do i fix thi",25
1039464387730399232,"i can now see the domain in app servic domain but ad a hostnam bind fail with fail to bind hostnam x on y x is not in readi for dn record manag do i just need to wait longer or is thi in a fault state",25
1039469455980392449,"we have alreadi submit the incid and have not receiv ani respons yet",24
1039472779324735489,"nail it seem like deploy a new domain conflict with someth never good to see internalservererror with no obviou path to recoveri thank so much for the link",25
1039475876860190721,"aztechhelp need to get an azur repres to meet with us and discuss option current high latenc is caus issu with site perform for some client aws ha a direct connect solut which elimin latenc issu",214
1039481795618717698,"hi there we are face with sever issu and timeout deploy azur sql databas in north europ is there ani gener issu we do not see anyth in statu page",25
1039482267717042176,"i realli wish would fix the lock file problem with deploy to app servic function i know we have run from zip now but i have a whole load of pipelin that predat that that i realli should not have to dig up to workaround thi old bug",25
1039484597703266305,"simpli amaz",01
1039485431853793281,"do you mean my lock file issu",25
1039485898235113472,"it had me so lost for a while and no announc or hey we move your stuff tour or anyth or at least not that i saw",13
1039485975108284417,"privat azur repo are charg base on the number of engin you have first folk free then around 6 a user no limit in the number of privat repo",37
1039486281481211904,"thank not a super obviou move consid how long we had been use the oldish way of do it ms doc do not reflect the new chang either",26
1039486387328876544,"i did not see anyth either i just randomli saw the icon",13
1039488289177305090,"there is a cmd to check that via powershel",313
1039488481058279425,"good morn afternoon hope you can help me out is there someth in the plan to support job schedul for you sql job in azur data lake analyt exampl if not what is the prefer option is it still azur data factori",26
1039489432179683328,"if one day somebodi at microsoft put the custom in front of the cart it will be a day mani tech giant will hate",015
1039490122721505281,"ye it is annoy i even put a section in my latest pluralsight cours on how to work around it becaus i hit it so often",24
1039490520593190912,"it doe make sens except we have an azur onli infrastructur so now i m doubt between use data factori or azur autom powershel but in the long run it would be great to have a nativ option in adla to schedul job but not sure it is on the roadmap somewher",317
1039491219087417345,"it thing like thi that lead to me often find to feel half finish and it utterli confid sap and reveal of how is so strongli market led to find the respons to bug like thi to be tri the new shini thing",015
1039491669568245760,"it a common and well known problem so i m sure it been rais with you mani time in th past and will be in the feedback section the advic i saw a github issu thread just last week is gener to tri run from zip but that is not a fix that is adopt the new shini",37
1039491846232260608,"happi to adopt run from zip on new project but when you have got a larg backlog of older pipelin suffer from thi nasti bug it a lot of work to revisit them all",25
1039492946830262272,"i suspect it a deep architectur issu with the ii foundat but given reliabl deploy are so import that pose some interest question wa thi known about pre ga of app svc whi wa it deem accept what els ha gone through a similar evalu process",25
1039493886866022400,"hey how can i ert just a specif type like virtual network to an arm templat without all the other stuff like vm s storag account a s o",313
1039495151104798722,"thank you for your help the idea is post would love to hear back from you so i know whether or not to spend time on build a solut or wait for a nativ option",01
1039495804686233600,"hi im tri to whitelist my ip in firewal sql databas but im getr erorr doe not have author",25
1039496336507396097,"i want to ert the entir configur of my current architectur like vnet s local and remot gateway and their configur for my document if i tri the common ert i get all resourc",26
1039496517642530817,"hi our friend may be abl to help thank",316
1039498809775149057,"awesom thank for your help and have a great day",01
1039499034690547712,"i appreci ur help after some research i ve chang the find azurermresourc cmdlet to the other get azurermresourc and the runbook work",317
1039499857667416066,"what is up with the azur sql config blade today all of a sudden start to show messag below today ani clue or confirm what chang are made to the subscript",313
1039500368143704065,done,49
1039500463647776768,"thank sent it",49
1039501401745973249,"can you share the workaround thx",313
1039501422071635974,"hi kindli assist with abov",316
1039501896246026246,"thank that is how support should work great work mb",01
1039501988910780417,"as you deploy the virtual network there is a tab that will allow you to see the json for your arm and allow you to ert or save",317
1039502318855774208,"checkout thi answer i solv it thi way",317
1039502552864317440,"ye but what if we made chang after the deploy and what if we want to creat multipl version for our document",313
1039502759634989057,"ok thank",01
1039503141236961282,"i usual just stop the web app deploy then restart it but there is also an app set you can tri msdeploy renam lock file 1",317
1039504258499047424,"in disat recoveri asr we have the default polici tell point everi day should then be hourli instead it repliact as default everi min from azur to azur vm is thi eect",25
1039504448018632709,"same here i deploy from vsts sorri azur devop and have the variou set like thi one set but the issu still occur regularli super annoy",24
1039506246867406848,"unfortun that is not fool proof either but doe seem to reduc the number of time it happen the servic i wa deploy thi morn and i ve just check have these set it a right mess",317
1039507041100881920,"let us assum you built a cloud architectur with a vnet some subnet secur group local and remot gateway and all the other relat stuff and now you want to creat a reproduc code file for your document and your repo enough detail",313
1039508222657224706,"ah ye my rout so far ha been to stop the web app will tri the set thx",316
1039509747441926144,"i ve got payment is past due there is a problem with your payment method but then there are no outstand charg and updat my payment detail ha done noth my subscript ha been disabl how can i fix",25
1039510591075840002,"i creat alreadi a post here",49
1039512525069373440,"i m have some issu with call between api that are both host in southcentr wa not have these last time i load test back in june are you still eerienc fallout from last week outag",25
1039512765155561473,"great thx i just wan na know it no need to escal it take your time",01
1039528772394000384,"hi guy do you know of ani problem regard the servic bu in the west europ region",25
1039530293659623424,"may not be what you are look for but check out thi is the arm represent as azur see it you will be abl to extract the specif resourc you want but will have to clean it up a bit you can the visual use",317
1039530608731598850,"tweet sent from 000 ft so pleas forgiv typo",49
1039531281611149312,"well it seem that we are unabl to connect to one of our namespac product seem to be a littl slower but not realli error there but if we connect via servic bu elor we do not get our queue and topic",214
1039534107854819328,"we will look into it and get back to you if the issu remain thank for the help",01
1039536342408065024,"azur servicefabr runtim notif is there ani way to get alert about these i do not see ani correl activ log or sf oper log entri for thi neither is the sf cluster health in warn state cc",26
1039536498922541056,"feedback a question such as what futur hold for a product go out of preview and is ga ed doe not belong to a forum doubt pg ha a solid answer for that yet so commun can onli guess not answer",313
1039546635913781250,"hi i have access problem to my db becaus my domain wa transfer to other dn i regist the domain ip in the firewal but i do not have access yet how i can see the reject ip request",313
1039549939477401600,"azhelp have a product server vm down support tick id need some help determin whi it is down from a simpl restart or restor from backup",25
1039550353103089664,"azhelp hey guy i am have a big problem becaus none of my web app are enabl to add custom domain",25
1039551118030921728,"our friend should be abl to help",316
1039551389050052613,"let me",49
1039551525104902145,"i wa use microsoft bizspark subscript now it eir how may i use renew subscript i have a domain in it and unabl to use now pleas help",313
1039553701474693120,"ad new scom assess solut for log analyt click solut requir addit configur tile noth happen tri edg ie and chrome on window other nearbi link do work",25
1039558721117073408,"i am pretti sure that datacentr east us region is hurrican proof but to be safe we activ asr to west us",317
1039558934284009472,"thank you for that",01
1039559123971407872,"need help for creat new azur account for former ms employe",313
1039559403119235072,"how do custom get the sla credit for thi outag that occur",24
1039562232697380866,"aztechhelp when i set up my ubuntu vm i onli check http but now i want to open up http to pull in data from http websit can you help",313
1039568083315314688,"would love for my site to work that is host with you",24
1039579829291675649,"hi guy i have problem with my web not respond en the vm all is correct but no respond i have the problem with vm",25
1039582096937951232,"azhelp after a failov is there an option to read write to the secondari server rather than just read onli and have it sync to the primari db server onc it is up again",313
1039588728627449856,"thi doe not seem to work for me on multipl machin",25
1039589346666577920,"ye i creat the stackoverflow post",37
1039594689173880832,"should ui be host with servic fabric as well or not i would like to hear what you peopl think",13
1039598272283860992,"where are azur east and east2 data center",313
1039599330942967808,"i have tri chrome amp edg on window chrome amp safari on mac chrome on samsung phone",316
1039601550317051904,"appear that it work i still monitor if continu with the problem send us a dm with subid region and data of vm thank",25
1039607007651815424,"a tini idea but mayb you could do someth about realli specif way you display function deploy it is rather a weird order",13
1039609070670540800,"thank will do",01
1039609543343390720,"can not creat a cloud servic no error messag in portal but can see error in chrome debugg when click creat button in final step pleas assist",25
1039610804881039360,"we have biz critic resourc in east us data ctr do you recommend that we proactiv cut over to our west us fail over in prep for hurrican flo",25
1039611545431564296,"not realli that link onli let us me log a sign in issu pleas read my messag thi is a not a sign in issu",25
1039612470674055175,"i ve been wait for a callback on ticket for over an hour after the tech said he would call me back in lt minut i m stay late to get thi resolv can i get a new tech or a callback our usual escal person ha left for the day",49
1039614783442616320,"clear it on mac chrome and same thing same error on all browser is it just me",25
1039615574362546176,sent,49
1039617328957321216,"thank i wa abl to get it escal by a differ channel burn the candl at both end",316
1039618721663336449,"that make sens will it be to much to ask if the data center are in the path of the hurrican i m start to replic my comput and storag to the west coast but if i can save by not do thi i would like to know",015
1039619483143430145,"that exact link work when i then click cosmo then calcul i get thi which ha the same problem",316
1039622924112678912,"thank for the help",01
1039646145751011328,"done seem to be that it doe not implicitli convert to an array type like paramet do and i can not elicitli specifi an array type from a lookup output",317
1039650292155834368,"i have found my answer thank both of you",01
1039652218520121347,"coupl of work around but seem i have to row set it back and let data factori array type it for me in my defenc it is pretti late i think it would be nice i could just pass back my array in document row",26
1039652682179465216,"and the problem is solv",49
1039660081925763072,"set your app set to includ msdeploy renam lock file set to someth about delet file that are lock that can not be done but renam is fine",317
1039660292895121408,"thi btw bypass ani restart or other black magic ritual it just work",317
1039669364574707712,"you realli should updat to run from zip so much better and not just for thi",26
1039671906352472064,"aztechhelp fyi you have a typo in the notif for download a vpn config file the word download is spell donwload",13
1039672871004434432,"i ve been fight with that problem recent as well incred annoy",24
1039678537417064448,"it is not in the document it is in the notif that come up after you download the config see the screenshot attach",211
1039679603365879809,"great move all resourc to west region just to be safe",49
1039703123168845824,"when are you go to creat permiss for mfa manag without need ga permiss rbac",26
1039710826448470017,"a week without servic accus nonpay be that all invoic were paid disclaim with the subscrib",24
1039735684028870656,"thank for the follow up the resolut wad provid and commun over the email",01
1039737391433564160,"ye all of it we have tri app servic on window we have tri app servic on linux we have tri app servic on linux in an app servic environ we have tri web app for contain in an app servic environ all seem buggi in their own uniqu way",316
1039756915071492096,"aztechhelp when will cosmosdb support mongodb version thi is someth that is necessari for those who use discrimin and can not use lookup properli without a pipelin to confirm for what type are we look",26
1039763029263638530,"it wa work till yesterday",49
1039765033251733504,"azur support team in india is not make progress on ticket we have been wait for our app servic to scale from server to server for nearli three hour now we have a site that is go to be featur on nation tv in a few hour what should we do",49
1039766955811635200,"screenshar over skype poke at variou thing in the portal did not solv anyth se seem out of idea and want to end the call to do more research we are run out of time over here befor big market event",24
1039769865937072129,"aztechhelp doe the ak in the south east asia have some problem it is to slow",214
1039779916969996289,"i would like to instal rtool to function but it is noth at site extens galleri what should i do",26
1039781868529315840,"i use azur portal",49
1039782939825987585,"that is exactli the document we found howev we could not find the gener health event the doc are mention neither in sf oper log nor in window event log our sf cluster is not in warn state yet ani idea",211
1039784685591846912,"thank for forward to the sf team",01
1039790175067557888,"sorri to hear that can follow up with that issu thank",316
1039803476593717248,"our subscript is pay as you go 337ea447 b1b9 49d8 91f3 c234c82e3b18 locat uk west",49
1039803789664903168,"you can check topic privalgo rockit topic there are mani messag couldnot been process",49
1039806307107188742,"i want to upgrad the my applic which i implement in microservic fabric so now i need to upgrad the applic pleas help out for thi",313
1039809341442981889,"sorri to hear that can investig that issu thank",316
1039810859428544513,"it is not what i need pleas tell me how to add environ variabl with kudu",313
1039811018199887872,"hey can you make it clear what payment method you actual support i just lost half a day tri to buy a visual studio profession licens with a debit card",13
1039811103147089920,"sorri to hear that alan our friend can look into it thank",316
1039813974517313537,"that is not an issu ani more i m ask you to updat your document and payment portal make it absolut clear what payment method you do and do not support to save other peopl the stress of be unabl to pay and not know whi",13
1039814741743550465,"especi now that even buy visual studio requir an azur subscript which requir a credit card mani mani peopl in the uk do not have cc it is realli confus",26
1039815115363762176,"cc you are awar that it is imposs to buy a vs licens with a debit card in the uk right",26
1039815552846376960,"tri on differ machin as well but no luck",316
1039821252356177920,"we have inde but want to see if anyon know of anyth go on at the moment",211
1039822338076893184,"thank for the pointer much appreci",01
1039825017154883586,"i have just creat a ticket thank you",01
1039825703422885888,"are you sure",49
1039830822092779521,"london uk",49
1039831839995822080,"today morn",49
1039831881238368256,"aztechhelp how to reset sql databas usernam password",313
1039833949974003714,"i m in the uk",49
1039841436244602880,"i have neither i ve liter just come onto your site and tri to get a sens of price befor sign up for anyth",316
1039847253446418432,"littl updat from me i think i will start with powershel get the json for the virtual network via api delet all not need resourc and convert it to markdown customscriptsrul",317
1039853230577123328,"sorri to hear that david can follow up with you thank",316
1039854346052067328,"the support team ha simpli close the case without assist us with our issu",24
1039856146738237440,"no prob i m in the uk",49
1039857809117143041,"ye ye ye ye ye ye",49
1039864381151092738,"same issu here tri sever browser and machin also tri a coupl of distinct network",316
1039871606666002434,"not realli we have tri scale up and out but still get the same behavior",316
1039872408876994560,"it is also happen across multipl queue",49
1039873464868524033,"i just creat a directori in the portal and i can not find it i onli see the default directori",13
1039874246321811457,"it happen regularli on one particular queue",316
1039876427028422656,"sorri folk for the confus we have a blog post come out in the next few day also i would love to learn about your eerienc can you pleas contact me at lwelicki com",316
1039879451415334917,thank,01
1039881414764908546,"is there a more up to date list of what is avail in each region than thi for exampl it show tabl storag as not avail when it is thank",211
1039883657387761664,"see attach photo for link",49
1039892259746054144,"folk thi is realli stupid busi debit card for starter are more like than busi credit card what is go on",015
1039896490272071680,"both we are tri to creat a cluster it might be someth relat to the max number or core use in the subscript",313
1039896621042032642,"yeah i can see the logic requir a credit card for person azur use but a requir cc for busi use is dumb whi not just offer invoic immedi b requir it for buy a sod visual studio licens c mon",015
