id_tweet,text_tweet,main_category
1041931205468454912,"i do not think so i can recreat thi in multipl tenant i think the app reg blade is somehow ignor the oauth2permissiongr against the serviceprincip mayb the sharepoint code is set a field with an invalid valu",316
1041947303639240704,"hi where ha the new white background default theme for the azur portal gone it wa there onli a few day is it come back ani time soon",26
1041954214925291520,"the onli differ i can see in the oauth2permissiongr on the serviceprincip is in the eirytim field the permiss creat via the app reg blade have an eirytim of around month the permiss creat via sharepoint are set to 9999 12 31t23 59 59 9999999z",13
1041954688550219776,"so is it possibl that the azur ad app reg blade see these permiss grant as somehow invalid the graph applic endpoint also doe not surfac these permiss grant which i believ it should as part of the applic requiredresourceaccess array",26
1041955675050532866,"i am unabl to verifi a custom domain use txt or mx record on azur activ directori even if the dn ha been updat and the chang have been propag what could i do",313
1041960336637784064,"hi is there ani benefit we get by go to pay as you go dev test subscript when i use linux vm s",313
1041962865387872256,"aztechhelp hi i am tri to set up ma webapp so that it use connect keep aliv in the respons i have ad lt httpprotocol allowkeepal true gt to my web config howev the applic still doe not seem to respond with the given header best regard",313
1041963171773333504,"hey pleas for all user saniti pleas stop move thi button where to select tenant thank from everi csp",13
1041967575788335104,"thank guy",01
1041968948437282817,"hello my rdp is run but doe not connect solut",25
1041970399154778112,"azhelp i do not understand the bill i got inmi account",313
1041988282442309632,"we have suddenli overload cpu and servic unavail in web app in west europ is there an outag",25
1041990619714015232,"here you go",49
1041992262652227584,"aztechhelp hey is there ani way to convert a fix cosmo db collect or databas to a unlimit one without use the migrat tool to migrat gb of data to a new collect will take hour",313
1041993965204058117,"hi juan our friend may be abl to give you more insight on what you need thank",316
1042003595980406784,"i have a pay as you go subscript with onli basic support i vm requir to talk to extern smtp server on port for send app relat email how do i get thi fix i have not opt for support",313
1042003882409197569,"hello can you confirm you establish a partnership with tradelize on the ukrainian divis thi cryptocurr project is not give out ani detail sinc the complet of their ico veri shadi onli thing they told is that they partner with you thank",37
1042007782147284992,"ye that is the account i tweetet to i m confus if you mean i should address them differ reason for ask wa thi page small team there say azur pipelin host job with 800 minut per month for ci cd and self host job",313
1042008756630900736,thank,01
1042011990909177856,"aztechhelp hi i have a problem with sync azur sql databas to other databas list of sync group is onli load what i do wrong",313
1042026425191211009,"ani resourc on how to set up use arm templat can onli find doc for usin",313
1042029497753718787,"so the feedback that i got wa to use adf",316
1042038119149723648,"can you submit an issu on the azur portal under the help and support in ui categor as aad",13
1042038554023665664,"i regist my domain name at azureport but now i want to close my azur account and move my domain name how do i get the epp auth to do it my subscript plan ha eir",313
1042039285086662656,"i guess i will tri it out tonight",316
1042040157988380675,"bad eerienc with support from indian team of mindtre i would",015
1042041071293931521,"azhelp file sync problem can not see the previou version in window r2 regist server cloud tier is disabl storagesyncag v3 ws2012r2",25
1042042804397137923,"my whole busi is down i need a senior engin right now",25
1042049002819280898,"i tri to enabl replic last night of three vm in a recoveri servic vault and hour later it is still stuck submit deploy ani idea",25
1042050877618626566,"i need an engin urgent it ha been hour and i open a busi critic ticket",25
1042051193416110080,"no it doe not help becaus i am unabl to creat a record without an activ subscript plan and what i want is the epp auth code not to add dn record",25
1042056145375035393,"aztechhelp can not connect to network at all thi am reboot all server still no go",25
1042056329614057473,"i receiv notic last even thi wa fix and just confirm use multipl account that credenti are now pass correctli between azur portal and azur storag while import ert databas to sqlserver thank you much johnt",01
1042059881057079296,"aztechhelp did someth chang recent with the bing api v5 we are have issu tri to use the search null pointer",25
1042061334010056705,"aztechhelp i m tri to reset the password for a pgsql databas but get thi error an uneect error occur while process the request track id 6e75efca b0ed 4bfd b7a9 f2d743ddaf27",25
1042061446862069760,"aztechhelp we have had particularli hi dtu usag on one of our databas sinc am thi morn bst i ve check queri from our app and none of them would contribut to such a level is there anyon who could check",313
1042062751907106818,"i am wait for help it ha been th hour",313
1042072431358365696,"are the problem with storag in west europ unabl to provis a storag account use an arm templat",25
1042073157786656768,"okay i will do that thank wa not sure where to rais thi but know now cheer",01
1042073785124446209,"problem seem to be solv just took minut",316
1042076487023779841,"whi is that error messag appear after publish from",25
1042077225426845696,"whi do we need those trail dot after the nameserv azur dn",13
1042082568659759105,"did you get the resolut from ms",316
1042082857760550912,done,316
1042084049072738304,"hi there we locat thi document that may help you out that be said we would suggest you reach to for further assist",316
1042086390379565056,"aztechhelp we are have troubl with the servic azur databas for mysql sever conecct pleas contact us urgent thi is not the first time",25
1042087375009210368,"not yet it seem that the publish suce then i click ok and that dialog is close",316
1042089105385971712,"tag with repro step to the extent possibl within charact activ monitor account they sit down the hall from me",25
1042089200240283649,"i sent you the messag with more inform",49
1042090952985374720,"aztechhelp my vm suddenli lost access to the internet how to fix it",313
1042091649755742209,"aztechhelp whi can not i add a new sql server to my account so i can have failov",26
1042093546453389312,"if you have a partit key on the collect and scale it to gt ru it will becom unlimit pleas feel free to connect with us at askcosmosdb com and we will help thank",317
1042099940418179072,"azhelp crm portal contact delet by mistak reregist use ad login option restart portal but still can not access cm can access portal center and crm just not the livef view cm portion check azur ad and the user is global admin",25
1042100619182403585,"aztechhelp tri to add a new user and it say the domain name is not verifi",313
1042103714713092103,"stay up to date with what is happen in azur devop by",49
1042114087738466304,"azhelp tri to setup custom domain and get the error verifydomain can not verifi an email verifi domain with non whitelist servic plan",25
1042116258387374081,"thank you for your repli we need to migrat to a partit unlimit collect but we have no partit key today as i understand it it not possibl to add a partit key i will send you an email thank you",26
1042118003633082369,"aztechhelp how do i instal dbo sql server in the web app i use laravel x howev it doe not support sql server driver",313
1042120000830496768,"i am abl to login to the portal but befor if i hover over an element it would show me the edit option no error messag just not abl to edit the portal",13
1042122938579730433,"in the custom domain name ui i see unabl to verifi domain name in powershel i get messag domain verif fail with the follow error verifydomain can not verifi an email verifi domain with non whitelist servic plan",25
1042124249308131329,"i did see thi i tri to creat a support issu on just thi case but i do not have a support plan doe troubleshoot thi issu requir a support plan i do not know if someon ha regist my domain name alreadi",313
1042124560865341441,"thank you",01
1042125920989929472,"thank subscript id is c00595 911b 4cc6 8f8d 6c8dd50c3106",316
1042127231382773760,"correct thi domain should not be tie to ani other account",316
1042130016908103680,"azhelp requir urgent action",25
1042131907046072320,"here is the link",316
1042138602044391424,"i ve got an azur ad setup i ve also got an azur sql databas in place use my msdn subscript at work is there a way of put those on paus sleep whatev while i m not use them",313
1042144099795705857,"our friend should be abl to help",316
1042144919379484673,"so i need to call your number to let you know about phish no pleas",49
1042148713894825984,"thank you for that suggest i remov the portal user role and ad administr and then a reset seem to give me access now two thumb up now back to my web form issu troubleshoot",01
1042171708143218688,"azhelp our server are not fulli reboot and get hung i paid for the support and wa told i would receiv and updat almost hour ago and have not heard back how do i light a fire up someon s a we need access to our data we are on a deadlin",015
1042176274070945792,"i think i repli with my support number to a dm",316
1042185115256938496,"hi there may be abl to help you with your question",316
1042185314201206784,"mayb you can help",49
1042187811368132609,"thank have sent a dm",49
1042193651722592257,"i manag to find an old email with the subscript id have sent thi via dm",316
1042226512970211328,"hey i am tri to take a data scienc vm for a test drive unfortun can not connect via ssh or ani other mean doe not show up on marketplac either spin wheel what is go on",25
1042228938292944896,"hi it is a test drive vm deploy through the market place it doe not show up in my portal thu can not follow the troubleshoot protocol",25
1042229510622441472,"access from three differ comput same issu with ssh everywher on one i can see the hour timer tick down in the web browser",25
1042246883224150016,"i have been tri to creat a data catalog and no matter what name i enter i get the error catalog name conflict with a reserv word ani idea",25
1042248586002685952,"thank you as an fyi i tri on differ browser",316
1042251818103975936,"azhelp i can not open up a servic request except for under aip we have an offic e3 subscript advanc threat protect and cloud app secur we have user lose their connect and lose their data can someon pleas help",25
1042254717894754304,"aztechhelp bad gateway error",25
1042255162994245634,"get bad gateway error on my azur webapp",25
1042262296557506560,"eert advic on azuredatafactori would like to push excel raw input file into azuresqldw",26
1042281131725348864,"mattia pleas connect with us at askcosmosdb com thank you",49
1042285491603816448,"rephras my question current jira integr with logicapp is in public preview and not in ga state do i need to take ani limit into consider in preview state",313
1042305105897422848,"i got a lot of error from azur applic insight avail monitor yesterday and still see some could thi be relat",25
1042314128310845440,"hi sinc yesterday all my vm scale set report that it fail when start multipl vm extens fail to be provis on the vm pleas see the vm extens instanc view for detail noth in portal but with ps i have fail provisioningst whi",25
1042316916365434882,"i need to copi some sql tabl from db on prem to azur sql pleas give some link can we use backup and restor method",313
1042317742366310401,"unabl to creat inbound rule in my nsg if i select http from servic the ok button is disabl evn i am unabl to link my nsg to my subnet insid a virtual network both be in same locat and even same resourc group quick respons need",13
1042319159353327616,"pleas provid more detail like the resolv ip address of jsdelivr email it to dak io or open a github issu and we will tri to help as soon as possibl",37
1042319270821199872,"thi show to migrat the data but i just need to add some tabl from on prem to azur sql which is alreadi live server thi is one time activ onli and doe not need to be sync",313
1042319380028243968,"hey are there ani global problem with aad in west eu azur statu is green top to bottom but we have an entir compani not abl to consum ani servic which reli on aad",25
1042322497658597376,"that email did not work got a deliveri error i post on github instead",37
1042332140212576257,"thank for repli in my case all extens were work correctli and i m not will to remov them for now what is strang that when i chang the capac the povisionnig state of new instanc and the old one for the extens is succeed",316
1042332606560460800,"is there ani way to delet the azur logic app run histori log and azur function monitor log i m ask thi in correl to gdpr as in some case sensit data can be run through the differ resourc",313
1042333312650498048,"did not get ani email we will respond in the github issu you open thank you",37
1042334244410978304,"sure i will look there thank just anoth question how can azur ensur it user that the platform is gdpr complient regard it is product then",24
1042335090754428929,"fyi it is still up",49
1042335933826248704,"hi my card wa thrice debit on th sept at about hr gmt with narrat mst there are no pend invoic in azur and debit reason still unclear will realli appreci revers of my money back to my account",313
1042336653401051136,"there is a websit run on azur that is phish for offic usernam and password see my retweet the site is you can chang the login email address simpli by chang the email after the in the url",317
1042336772083142657,"see a weird issu with a function app v2 all the endpoint proxi and direct function return error wa work yesterday same deploy in anoth resourc group work fine redeploy ha no effect no error log that i can see",25
1042337159645196288,"i have done that on same day but could not find it in my support request list will tri that again now thank for the swift respons hope to get thi sort as soon as possibl thank",01
1042337776283332609,"they have not respond the hacker code is run in azur you need to escal thi and not ignor it",313
1042338613172858881,"i guess i will have to rais one will they provid support on v2 with it still in preview",313
1042338978064736256,"hi oliv i m from the azur team just escal intern we see it",316
1042339125158981632,"thank maggi",01
1042339143370649600,"hello we have a support ticket open but it assign to a team in the wrong time zone how can we transfer the ticket to a team in our time zone",313
1042341775199940608,"it veri strang i ve notic that follow a restart for a few second it will work but return random and error on request no obviou pattern and ultim will end up in thi everyth is state there are no timer function in the app",25
1042342877869817857,"i m have troubl enabl curl on our drupal azur webapp can you provid some guidanc pleas",25
1042345304283066369,"aztechhelp someth is wrong with the autoscal west eu the instanc hang on the busi state for hour thu prevent further autoscal oper howev the instanc in busi state work properli rdp ii etc i have to manual reimag them",25
1042348307832557569,"well our drupal develop is tri to enabl curl by modifi the ini file through ssh but after a restart everyth is revert back to what it wa befor i understand whi but what i need to know is how we configur thi through azur config",313
1042353191277551616,"thank that doe not help we have drupal work on a web app in azur but the onli bit we can not configur is curl",25
1042356473177808896,"when use passthrough as pre authent option within the applic proxi set on a azur enterpris app is condit access on that app still support notsur azureapplicationproxi",26
1042364229997744128,"ok so i ve read the blog it did not tell me more than i ve alreadi know regard gdpr have been deal with thi for a while i m interest in is more compon relat info not gener inform is there ani work be done on thi topic outsid of thi question",211
1042364398185009153,"regard support servic in eress rout it mention that traffic manag is not support for microsoft and public peer will it be support if we use ase s webapp can we use traffic manag with eress rout",313
1042365369422409728,"whi can not you show disk iop detail over the portal if you can show other usag detail over the azur portal thi is so frustrat to gener each ticket to for each vm to get iop detail which take age",015
1042366254193860609,"so is thi appli for privat peer for ase webapp",313
1042367465907339265,"i have creat a new sql databas how can i upload file on it",313
1042368469306691585,"aztechhelp deploy event subscript poc eg1 deploy ha fail with the follow error undefin it ha to work whi not",25
1042370750907404288,"aztechhelp found that data factori by one day consum on dev environ eur whi what happen",24
1042371518326624256,"what detail do you need to check what is up",313
1042372212760686592,"whi you want me to write thi thing there whi can not you take my input from here onli",24
1042372579334479873,"i get mail from you to pay my bill i would like to do it but i need help and i do not get the help on the help site pleas contact me in an not autom way",313
1042374853951672320,"azhelp is anyon work there thi morn i wa dump off so someon could leav with a promis someon would call me back in less than o minut and that wa hour ago i need my server up and am not happi hour of support and no resolut",015
1042375518958616577,"unus if you are on the go and just want clarifi an easi thing like bill",24
1042376290874155009,"what i exactli want is to be abl to delet all the log inform run histori monitor log log analyt log in logic app function and log analyt to ensur not store sensit data in azur portal accord to gdpr guid line thank you",26
1042378159759470592,"here you go",49
1042378565654859776,"i got to the bottom of it the runtim that roll out thi last week 2 0 12095 ha broken proxi i ve pin back to 2050 and am back in action",25
1042380349022646273,"just found out that use standard ssd disk mean no azur backup would have been nice to have been warn",211
1042381264735621120,"i am tri to creat event grid subscript over event grid topic all paramet are fill in all field green but on subscript creat we see those error",25
1042382069253459968,"report through",49
1042382329417740289,"name eg 1 properti topic sub destin endpointtyp webhook properti endpointurl filter includedeventtyp all label eventdeliveryschema eventgridschema",49
1042386364849942528,"the web ui what is thi a portal for ant i need special glass for thi thing uxfail",13
1042386442461356032,"ok final i found the workaround by creat the subscript from azur function directli thank",317
1042387875382394880,"interest challeng with azuread today how can i give a guest user e g azureb2b access to the azur portal easi enough when i can send an invit to a mailbox what happen if my guest account is not mail enabl e g it is a privileg account",313
1042388172859236352,"super tini font i need to squint to see read anyth well ye i could zoom the text but still",13
1042388830781882368,"i have a question about aip i can not seem to find were i can revok or track an email sent with an aip label is it possibl i would like to be abl to revok access to either the email or just the attach in it",313
1042388894514241537,"i want to associ of my azur ad to the same azur pay as you go subscript pleas tell me how to do",313
1042394507336208384,"it not what i m look for i want to revok access to a file i have sent via email or the email it self if i send an email to jon com and appli aip with permiss viewer i want to revok that view capabil so jon doe not have access to open the email or file",313
1042398033344774144,"hey amp when i select publish page from vs to azur not a full publish just 2 page the chang do not show up they onli show up when i do a full publish what am i do wrong",313
1042400232657563648,"aztechhelp just thi morn cosmo db tabl start return http error for bad request url and are no longer display ani inform in the data elor is thi just for me",25
1042402652578037761,"aztechhelp an azur function app have a weird behaviour sinc yesterday ani call to azur function return http function host is not run no deploy have been made in the last day",25
1042403048285454338,"azhelp i m tri to add a guest user to a tenant through code and the portal i get a success notif but the user is not ad to the tenant ani other user i invit work fine ani idea on what the issu could be",313
1042403681935781889,"hey azur whi is pan id compulsori for sign up for a free azur account from india you are alien million of student engin develop who do not have pan id or do not want to share thi person info they are all stuck pl rectifi as soon as possibl aws doe not requir thi",24
1042405262504747008,"dm sent",49
1042406647140900864,"hi where can i find the tl version and cipher crypto strength be use by the azur app proxi connector and servic azureappproxi",13
1042406949697085442,"i log into azur portal and wa present with a messag that azur advisor ha a messag for me i go to advisor there is messag under secur click on the secur squar high impact messag click on the row blade on the appear show zero messag",13
1042407023927808000,"hi is it possibl to download the complet chain of certif from is thi a ca manag by microsoft",26
1042407828554702850,"hi traffic is termin at the azur app proxi servic from client and connector how is data in traffic and in rest process at servic level is it in temporarili cach in memori on storag is it encrypt at all time",313
1042409836267364352,"not exactli what im look for but maby it not possibl",316
1042410380180447233,"would you folk know about thi",49
1042412441446088704,"hi azur team we have some problem to verifi a custom domain in our azur ad would be great to get some support regard",25
1042413930822418432,"i do not see ani filter select if there are thi is how the screen is present to me by default even after leav and come back in order to take screenshot",13
1042414364974829568,"error azur portal unabl to verifi domain name ensur you have ad the record abov at the registrar and tri again in a littl while dn txt record is present",25
1042415510246318080,"sure where could i find it",313
1042419402434588672,"doe anybodi els get realli terribl column size when chang the app set on an azur app servic i want the first two column to be readabl a checkbox doe not need px of horizont space connect string are even wors cc",13
1042424379475415040,"ash q02 t50 is thi caus the slow in log analyt as well",214
1042434484166115330,"is thi an old or a new namespac have you tri to creat a new namespac to verifi tri to see if there is a problem",316
1042435149500170240,"thank sean i m happi to hear that topic should still be list under servic bu entiti and that thi is like a user issu i will check on the age of the namespac i do know that it wa there one day and gone the next though",13
1042441105311248384,"who do i have to bug at to get arm64 build of azur cli into the microsoft apt repo cc",25
1042443748561575937,"hello i had previous discuss the issu of not be abl to delet machin from back up out of our azur and there wa a one time support suppos to be set up but when i follow the link it did not do anyth the issu also appli to multipl pc",25
1042444182692945921,"azhelp can not creat iot hub",25
1042445861035433984,"it take me to the azur page servic health and then there is noth list under ani of the option to be abl to get the support",13
1042446657915445249,"have just done thi now thank you for the info",01
1042450372084805633,"that show up without issu my next question is when i follow the instruct from there and click the creat a support request i get stop where it want me to choos a support plan still",313
1042451107501539328,"thank everyon i m good now somehow the price tier chang to the one that doe not offer topic anyway not azur me",01
1042452988659466243,"do you have direct contact number for custom servic",313
1042455083458457600,"azhelp have an issu with my account can you help me out",25
1042456122639228928,"ye it is in the same box in the health advisori pane and is the bottom option on the right hand side",13
1042470075356332032,"is there a way to use ssd for azur contain instanc for extra",26
1042472642509455360,"would love to start an aci with better i o like an ssd seem there is no option right now to choos a disk type",26
1042476304946348032,"sure here it is",316
1042479530164801536,"i would be interest to know what other are consid as a mitig effort for a futur such outag and what doe microsoft plan to do long term about aad backup my cloud to anoth cloud make azur my failov and not my primari ani thought",26
1042483922624569344,"aztechhelp queri cosmo db by id from data elor spin with no result return how do i upgrad to indexvers cosmosdb",313
1042488611575353344,"i think the worst thing today is they have hung up on me twice for a critic ticket that ha been open for day i can no longer recommend to ani of my client becaus we can not get ani support on it",015
1042493855843667968,"we are suppos to have a new linux wordpress instanc run but there are no file the directori is just blank",25
1042511947340685312,"we do not have a profil there but if it doe not requir more than basic inform i should be abl to creat one and then work to do that if possibl",26
