id_tweet,text_tweet,created_at_status,truncated,retweet_count,favorite_count,retweeted,lang_status,id_user,id_str_user,name_user,screen_name_user,location_user,description_user,url_user,followers_count_user,favourites_count_user,lang_user,main_category,sub_category
1038379801650712576,"@AzureSupport DM sent","2018-09-08 10:53:31",0,0,0,0,en,137303423,137303423,"Nadeem mohammed",Nadeem_mohammed,India,"CEO at CloudQube
Entrepreneur, Tech Evangelist #AR #Holographic, #VR",http://t.co/t9mZJopP25,394,11,en,49,NULL
1038381159212875776,"@AzureSupport portal in iPad with Safari don't run. I have problems creating a virtual machine with the template. Error with ClearDBExtension.","2018-09-08 10:58:55",0,0,0,0,en,931810642838917120,931810642838917120,"Ignacio Pablo",ignatiuspc,"Zaragoza, España","Programador de MS Dynamics NAV, marido y padre. Escribo el diario de un programador de NAV.  Aquí hablo de #MSDynNAV, de #F1, de #Series y de #Cine.",https://t.co/AEQdguhiPU,30,5,en,25,NULL
1038391649217531904,"@AzureSupport What is open as a team?","2018-09-08 11:40:36",0,0,0,0,en,76093327,76093327,"Chirag Shah",chineel,,,NULL,12,113,en,211,NULL
1038395507511570432,"@AzureSupport I had opend the case and I got the call, the person on call talked me that microsoft don't support debitcard in India! You must arrange a credit card to create free account. Case was created for chinil@hotmail.com. now is it still open or closed by your support guy I don't know.","2018-09-08 11:55:56",0,0,0,0,en,76093327,76093327,"Chirag Shah",chineel,,,NULL,12,113,en,26,NULL
1038395938056880129,"@AzureSupport When I am not being able to create my free subscription. How do I have an active subscription?!","2018-09-08 11:57:38",0,0,0,0,en,76093327,76093327,"Chirag Shah",chineel,,,NULL,12,113,en,25,NULL
1038398247558103041,"@AzureSupport I did it minimum 8 times till yesterday. Before  opening case and than I got the call from your support guy. You want me to try now.  One more time","2018-09-08 12:06:49",0,0,0,0,en,76093327,76093327,"Chirag Shah",chineel,,,NULL,12,113,en,316,NULL
1038399022384472064,"@AzureSupport Your support guy spesifically told me that you don't support debit card in India and I had got around 8 to 10 unsuccessful attempts you wants me to try one more time?","2018-09-08 12:09:54",0,0,0,0,en,76093327,76093327,"Chirag Shah",chineel,,,NULL,12,113,en,26,NULL
1038412404563091456,"Our biggest fans this week: @AzureSupport, @amandadeibert, @soniagupta504. Thank you! via https://t.co/eFlFufwhMX https://t.co/XiqfHkQyB2","2018-09-08 13:03:04",0,0,0,0,en,82755130,82755130,"George Walters",gwalters69,"Massachusetts, USA","Truth, Justice, Equality.  I am a Speaker, MSFT, Wife, Two Boys. Dog, Cat. John Deere Tractor, Challenger. Opinions are mine, not my employer's",https://t.co/EZqWpOFkP0,1207,46274,en,01,NULL
1038420395613872128,"@azuresupport #azhelp: subscription# 03b9465f-c07a-4c84-9bc7-e3efb76bff74, not able to connect to any HTTP or HTTPS ports on any servers in the Org, could check if anything was blocked on the Org that is stopping it from connecting?","2018-09-08 13:34:49",0,0,0,0,en,2996560849,2996560849,tarang,tarangrao,,,NULL,2,1,en,25,NULL
1038444548001869825,"@AzureSupport Great work @AzureSupport thanks for sorting out our problem. 👍","2018-09-08 15:10:48",0,0,0,0,en,2462182933,2462182933,"Symphony - APS",whysymphony,"England, United Kingdom","Relentless pursuit of new methods to transform software platforms and process for accounting firms.",https://t.co/FkReJHsa15,142,106,en,01,NULL
1038467976587079680,"@AzureSupport @jamieeduncan @CertDepot That article does not apply to a single node webapp running a custom docker image","2018-09-08 16:43:54",0,0,0,0,en,24503769,24503769,"Bart McLeod",bartmcleod,"Heelsum, The Netherlands.","Zend Framework contributor, coach and developer. WordPress fan. PHP developer. Painter. Sculptor.",https://t.co/lLbZLC1odC,275,72,nl,317,NULL
1038469615087702016,"@AzureSupport I am still facing the same issue. Started totally clean by creating a new B2C directory and linked my subscription. No luck. I had this simple thing working in the past.","2018-09-08 16:50:24",0,0,0,0,en,141624913,141624913,"A K Singh",afluxs,,,NULL,20,12,en,25,NULL
1038470403914706945,"@AzureSupport Never mind. I see my subscription after logging out and in. However, one thing I have noticed is that option to switch directories is missing from the Account dropdown in top-right corner. Have to access it from the Active Directory blade.","2018-09-08 16:53:32",0,0,0,0,en,141624913,141624913,"A K Singh",afluxs,,,NULL,20,12,en,26,NULL
1038473682837032962,"@AzureSupport I have sent u the details as I started facing issues again.","2018-09-08 17:06:34",0,0,0,0,en,141624913,141624913,"A K Singh",afluxs,,,NULL,20,12,en,25,NULL
1038473958562164736,"@azuresupport #azTechHelp
Hi,  my Azure Free Account is expired. But i can not downgrade my machine from B2S to B1S: This VM has been stopped as a warning to non-paying subscription.. VMStoppedToWarnSubscription
Can u help me?","2018-09-08 17:07:40",0,0,0,0,en,45625887,45625887,Netsn00p,Netsn00p,,,NULL,8,0,de,25,NULL
1038480024066768897,"Can someone tell me what is this for, @Azure, @AzureSupport?: ssh -A -oServerAliveInterval=1 -oServerAliveCountMax=5 -oControlPath=no -oControlMaster=no -oExitOnForwardFailure=yes -fNnT -C -R 9090:localhost:2222 12345678@akstest-ddaf12a3.tun.westeurope.azmk8s.io -p 22 #Azure #AKS","2018-09-08 17:31:46",0,0,1,0,en,2576179145,2576179145,Eosphoros,pwsh_guy,,"Наш путь извилист, но перспективы светлые
#Powershell #Azure #Automation #Microsoft and other technical stuff!",https://t.co/LwGSE7SRc2,34,3761,ru,313,NULL
1038480878899548165,"@AzureSupport @Azure It is an AKS cluster communications, taken from Service Map Solution","2018-09-08 17:35:10",0,0,0,0,en,2576179145,2576179145,Eosphoros,pwsh_guy,,"Наш путь извилист, но перспективы светлые
#Powershell #Azure #Automation #Microsoft and other technical stuff!",https://t.co/LwGSE7SRc2,34,3761,ru,317,NULL
1038488098823434242,"@AzureSupport Hello. Why the Azure Portal does not show the hidden resources related to the AKS? https://t.co/n8P7LocnpQ","2018-09-08 18:03:51",0,0,0,0,en,69075287,69075287,"Jesús Odreman",jodreman,,"Ingeniero en informática, software de avanzada.",NULL,114,311,es,211,NULL
1038494009621180419,"@AzureSupport Sorry, my fault. I just saw that the resources related with the AKS were created in other resource group automatically. Thanks.","2018-09-08 18:27:20",0,0,0,0,en,69075287,69075287,"Jesús Odreman",jodreman,,"Ingeniero en informática, software de avanzada.",NULL,114,311,es,316,NULL
1038503566049067008,"@AzureSupport @gh_geek @Azure @JakartaEE Yeap. Would appreciate more details to be able to reproduce the issue.","2018-09-08 19:05:19",0,0,0,0,en,14566379,14566379,"Bruno Borges",brunoborges,"Vancouver, British Columbia","Brazilian, Developer Relations & Engagement Strategist
promoting great developer technologies to the world. Now @Java☕️@Microsoft #Azure. Previously @OracleDevs",https://t.co/o1CCESfY4O,11885,34985,en,211,NULL
1038503836523094017,"@AzureSupport @Azure @JakartaEE @brunoborges I've a docker image pushed to Azure container registry, and exposed as web app thru Azure web apps for containers. It worked fine until just this evening I started getting service unavailable message.","2018-09-08 19:06:23",0,0,0,0,en,4351775008,4351775008,"Seeraj Muneer",gh_geek,"Greater Accra, Ghana","Java EE Developer, Trainer, Blogger.",https://t.co/KXPku2NwYP,103,981,en,25,NULL
1038504218187976704,"@AzureSupport @Azure @JakartaEE @brunoborges The image is still available on my ACR repo, and I didn't change anything in the Azure web apps configuration. It's set to use the given image, with the latest tag.","2018-09-08 19:07:54",0,0,0,0,en,4351775008,4351775008,"Seeraj Muneer",gh_geek,"Greater Accra, Ghana","Java EE Developer, Trainer, Blogger.",https://t.co/KXPku2NwYP,103,981,en,01,NULL
1038504415370661888,"@AzureSupport @Azure @JakartaEE @brunoborges It was working, and I didn't make any changes whatsoever. https://t.co/n2LXAyOYix","2018-09-08 19:08:41",0,0,0,0,en,4351775008,4351775008,"Seeraj Muneer",gh_geek,"Greater Accra, Ghana","Java EE Developer, Trainer, Blogger.",https://t.co/KXPku2NwYP,103,981,en,01,NULL
1038504844619800576,"@gh_geek @AzureSupport @Azure @JakartaEE Is it possible to post the image to Docker Hub so I can take a look? Also, the Dockerfile used","2018-09-08 19:10:24",0,0,0,0,en,14566379,14566379,"Bruno Borges",brunoborges,"Vancouver, British Columbia","Brazilian, Developer Relations & Engagement Strategist
promoting great developer technologies to the world. Now @Java☕️@Microsoft #Azure. Previously @OracleDevs",https://t.co/o1CCESfY4O,11885,34985,en,211,NULL
1038504866698731520,"@brunoborges @AzureSupport @Azure @JakartaEE Does changing the admin password on the container registry impact it's deployment as an Azure web app?","2018-09-08 19:10:29",0,0,0,0,en,4351775008,4351775008,"Seeraj Muneer",gh_geek,"Greater Accra, Ghana","Java EE Developer, Trainer, Blogger.",https://t.co/KXPku2NwYP,103,981,en,313,NULL
1038505275831906304,"@gh_geek @AzureSupport @Azure @JakartaEE If that was how the webapp for container initially pulled the image, then yes, that may be the cause.","2018-09-08 19:12:06",0,0,0,0,en,14566379,14566379,"Bruno Borges",brunoborges,"Vancouver, British Columbia","Brazilian, Developer Relations & Engagement Strategist
promoting great developer technologies to the world. Now @Java☕️@Microsoft #Azure. Previously @OracleDevs",https://t.co/o1CCESfY4O,11885,34985,en,316,NULL
1038505531093250048,"@brunoborges @AzureSupport @Azure @JakartaEE Ok I'll try and get back to you.","2018-09-08 19:13:07",0,0,1,0,en,4351775008,4351775008,"Seeraj Muneer",gh_geek,"Greater Accra, Ghana","Java EE Developer, Trainer, Blogger.",https://t.co/KXPku2NwYP,103,981,en,49,NULL
1038507912333647872,"hello @AzureSupport and other #azure folks. I have an Azure App Service which is running an ASP .NET project. How do I make my project connect to/access an existing Azure SQL?","2018-09-08 19:22:35",0,0,2,0,en,35923606,35923606,Daniel,kid_jenius,Canada,"Software engineer. UWP, C#, .NET, XAML, Azure, Python. Opinions are mine alone. Made @NightingaleUWP and Pillbox for Windows",https://t.co/0JI9obSEA5,601,33,en,313,NULL
1038508997475807233,"@brendandburns @AzureSupport Thanks for providing the email address.
Just FYI I had to re-create the AKS to resolve this issue.","2018-09-08 19:26:54",0,0,1,0,en,563574815,563574815,"Sahil Davawala",sahildavawala,"Ahmedabad,Gujarat",..,NULL,29,8,en,313,NULL
1038514245086765056,"@Azure @AzureSupport 
What's the price on such, an enterprise software?","2018-09-08 19:47:45",0,0,0,0,en,522624582,522624582,LiveDigital,LiveDigitall,Canada,"acquirer of fine tastes and luxuries, connoisseur.",NULL,250,3710,en,317,NULL
1038516797924884481,"@azuresupport #azTechHelp One of our two South Central VMs will not boot after the electrical/thermal event this past Tuesday. The other works fine.","2018-09-08 19:57:53",0,0,0,0,en,164282921,164282921,"patrick breedlove",46caliber,,,NULL,3,0,en,25,NULL
1038517882831949829,"@azuresupport #azhelp: I can't seem to delete a cert in azure nor can I view status - just hangs","2018-09-08 20:02:12",0,0,0,0,en,45510436,45510436,"Adam Davsko",adavsko,,,NULL,47,2,en,25,NULL
1038518827238273024,"@AzureSupport I'm trying to delete an ssl cert or even just view the status of it and it just hangs. It's been trying to delete for several minutes now.","2018-09-08 20:05:57",0,0,0,0,en,45510436,45510436,"Adam Davsko",adavsko,,,NULL,47,2,en,25,NULL
1038518971744575488,"@AzureSupport I figured there was something wrong with it when viewing the status was hanging so I figured I'd delete and create a new one but that hangs too.","2018-09-08 20:06:32",0,0,0,0,en,45510436,45510436,"Adam Davsko",adavsko,,,NULL,47,2,en,25,NULL
1038519960635625472,"@AzureSupport ok thanks","2018-09-08 20:10:28",0,0,0,0,en,188357972,188357972,"Ivan L.S",iva29234,,"El sabio no dice todo lo que piensa. Pero piensa todo lo que dice.",NULL,3,0,es,01,NULL
1038520017472692227,"@AzureSupport ok thanks","2018-09-08 20:10:41",0,0,0,0,en,188357972,188357972,"Ivan L.S",iva29234,,"El sabio no dice todo lo que piensa. Pero piensa todo lo que dice.",NULL,3,0,es,01,NULL
1038529624794443778,"@AzureSupport @Azure .@azure the status page says 48 hours for RCA, yet still nothing??","2018-09-08 20:48:52",0,0,0,0,en,2436901002,2436901002,"don’t mind me I’m observing your observability",EdDebug,London,"Fun things: WinDBG, Sql Server CI/CD, clean code, debugging, any language, any o/s, anytime! (Except tea time). #ALMRanger - https://t.co/eETw35nd7p",https://t.co/9tsjoCD4rv,666,6557,en-gb,211,NULL
1038534390677233671,"@brunoborges @AzureSupport @Azure @JakartaEE OK so you are right. It appears the AWA for containers does't work when the admin password is changed for the ACR. I think some form of error message on the dashboard when that happens would help out. It all seemed OK on the portal.","2018-09-08 21:07:48",0,1,1,0,en,4351775008,4351775008,"Seeraj Muneer",gh_geek,"Greater Accra, Ghana","Java EE Developer, Trainer, Blogger.",https://t.co/KXPku2NwYP,103,981,en,25,NULL
1038534563029549063,"@brunoborges @AzureSupport @Azure @JakartaEE https://t.co/SzACcc7V7V is now working fine after deleting and re-creating the AWA for containers.","2018-09-08 21:08:29",0,0,1,0,en,4351775008,4351775008,"Seeraj Muneer",gh_geek,"Greater Accra, Ghana","Java EE Developer, Trainer, Blogger.",https://t.co/KXPku2NwYP,103,981,en,317,NULL
1038536490664554503,"@AzureSupport @brunoborges @Azure @JakartaEE Sure will do that. Thanks for your very quick responses.","2018-09-08 21:16:09",0,0,1,0,en,4351775008,4351775008,"Seeraj Muneer",gh_geek,"Greater Accra, Ghana","Java EE Developer, Trainer, Blogger.",https://t.co/KXPku2NwYP,103,981,en,01,NULL
1038537601177792512,"@AzureSupport @gh_geek @Azure @JakartaEE My pleasure","2018-09-08 21:20:33",0,0,0,0,en,14566379,14566379,"Bruno Borges",brunoborges,"Vancouver, British Columbia","Brazilian, Developer Relations & Engagement Strategist
promoting great developer technologies to the world. Now @Java☕️@Microsoft #Azure. Previously @OracleDevs",https://t.co/o1CCESfY4O,11885,34985,en,01,NULL
1038538087947816971,"@AzureSupport  , @ActiveNick presented Azure speech &amp; more. How much it costs with types of services (a list of service items) to start dev.","2018-09-08 21:22:29",0,0,0,0,en,46319037,46319037,"Jung Hee Mun",realityjung,,"Just doing whichever I like to do and know how to do only - making art.",http://t.co/SipluH6C4H,77,30,en,49,NULL
1038538311269109760,"@gh_geek @AzureSupport @brunoborges @Azure @JakartaEE hey @SteveLasker, you might note this. :-)","2018-09-08 21:23:23",0,0,1,0,en,3453491306,3453491306,"home skillet",ralph_squillace,"San Francisco, CA","First a human. Second, Principal PM for open source dev experience on Azure Containers team, mostly always Linux and Mac and Helm, Draft, Brigade, Kubernetes.",NULL,1464,6828,en,49,NULL
1038539130140065792,"@ralph_squillace @gh_geek @AzureSupport @Azure @JakartaEE @SteveLasker You definitely should :-) pretty sure it will be a common thing","2018-09-08 21:26:38",0,0,0,0,en,14566379,14566379,"Bruno Borges",brunoborges,"Vancouver, British Columbia","Brazilian, Developer Relations & Engagement Strategist
promoting great developer technologies to the world. Now @Java☕️@Microsoft #Azure. Previously @OracleDevs",https://t.co/o1CCESfY4O,11885,34985,en,49,NULL
1038539510814978048,"@brunoborges @gh_geek @AzureSupport @Azure @JakartaEE @SteveLasker if it happened to you, it'll happen to others.","2018-09-08 21:28:09",0,0,1,0,en,3453491306,3453491306,"home skillet",ralph_squillace,"San Francisco, CA","First a human. Second, Principal PM for open source dev experience on Azure Containers team, mostly always Linux and Mac and Helm, Draft, Brigade, Kubernetes.",NULL,1464,6828,en,49,NULL
1038575189783543808,"@ralph_squillace @gh_geek @AzureSupport @brunoborges @Azure @JakartaEE Thanks folks. What your basically asking for is key rotation support. It’s an interesting challenge as why did you change the password? Was it to avoid someone using a leaked key?","2018-09-08 23:49:55",0,0,0,0,en,19380675,19380675,"Steve Lasker",SteveLasker,"Seattle WA, USA","@Microsoft, focusing on Container Experiences, PM for Azure Container Registry, Sailing/Racing, Climbing",https://t.co/IF78UwOuJS,701,877,en,26,NULL
1038575633675083781,"@ralph_squillace @gh_geek @AzureSupport @brunoborges @Azure @JakartaEE What we’re working towards is the ability to provide access to specific resources. Referred to as a Microsoft Identity. MSI. This will take a bit to complete, but it’s on the ACR and Web Apps roadmap.","2018-09-08 23:51:41",0,0,3,0,en,19380675,19380675,"Steve Lasker",SteveLasker,"Seattle WA, USA","@Microsoft, focusing on Container Experiences, PM for Azure Container Registry, Sailing/Racing, Climbing",https://t.co/IF78UwOuJS,701,877,en,26,NULL
1038575871009775617,"@ralph_squillace @gh_geek @AzureSupport @brunoborges @Azure @JakartaEE The other thing is simply providing a better error response. Unable to pull image. I’ll loop in the App Service folks to look into it.","2018-09-08 23:52:38",0,0,1,0,en,19380675,19380675,"Steve Lasker",SteveLasker,"Seattle WA, USA","@Microsoft, focusing on Container Experiences, PM for Azure Container Registry, Sailing/Racing, Climbing",https://t.co/IF78UwOuJS,701,877,en,26,NULL
1038576518056824832,"@AzureFunctions @AzureSupport can't seem to publish my function apps anymore? Microsoft.PackageDependencyResolution.targets(167,5): error : Assets file project.assets.json doesn't have a target for .NETFramework,Version=v4.6.1.... my proj is 4.7.1","2018-09-08 23:55:12",0,1,0,0,en,92331168,92331168,"David Buckell",DavidBuckell,"Bournemouth, England","Professional .NET developer.
Certified in Sitecore & Umbraco, trained in SharePoint & OpenText.
Born on Isle of Wight, moved to Bournemouth.
AFC Bournemouth fan",https://t.co/sv5RCYVFPC,365,45,en,25,NULL
1038592228988469249,"@AzureSupport @millh0use Our issues are resolved, it would be great to know what plans there are to add redundancy to vsts so this doesn't happen again... Our devs lost a day 😔","2018-09-09 00:57:38",0,0,0,0,en,234865574,234865574,Tristan,TristanS1,,,NULL,32,40,en,26,NULL
1038592779444781057,"@AzureSupport @millh0use Sure thing! Thanks!","2018-09-09 00:59:49",0,0,0,0,en,234865574,234865574,Tristan,TristanS1,,,NULL,32,40,en,49,NULL
1038655942982807553,"@AzureSupport @nicleroux Yep, all working again.","2018-09-09 05:10:48",0,0,0,0,en,274196340,274196340,"Frederik D.",effdeedee,"Berlin, Germany","Get off my lawn!",NULL,111,821,de,01,NULL
1038664831803514881,"@SteveLasker @ralph_squillace @AzureSupport @brunoborges @Azure @JakartaEE As part of a larger Java EE course, I taught students how to ship off containers to ACR and expose them as web apps using AWA for containers. After shooting the video, I had to change the original passwords used.","2018-09-09 05:46:08",0,0,2,0,en,4351775008,4351775008,"Seeraj Muneer",gh_geek,"Greater Accra, Ghana","Java EE Developer, Trainer, Blogger.",https://t.co/KXPku2NwYP,103,981,en,26,NULL
1038665097797922817,"@SteveLasker @ralph_squillace @AzureSupport @brunoborges @Azure @JakartaEE I think a better error response would do. Because I'd remember I changed the ACR password after shooting the video lectures before I could figure out why it wasn't working. AWA for containers looked OK on the portal.","2018-09-09 05:47:11",0,0,1,0,en,4351775008,4351775008,"Seeraj Muneer",gh_geek,"Greater Accra, Ghana","Java EE Developer, Trainer, Blogger.",https://t.co/KXPku2NwYP,103,981,en,26,NULL
1038667038259068929,"@AzureSupport Dears can any one help me .. i have problem with azure clouding ..i have deleted web service by mistake ..and this app services has no backup ..how i can restore my files ..please some help . Thanks","2018-09-09 05:54:54",0,0,0,0,en,1038666175276834816,1038666175276834816,"Hania Fathu",FathuHania,,"Take Me To Freedom",NULL,0,0,en,313,NULL
1038701501881966593,"Check my first article on #Linkedin about #Azure VPN connection 

@Azure @AzureSupport @AzureAutomation https://t.co/2v1MyFOOwt","2018-09-09 08:11:50",0,0,2,0,en,467246906,467246906,Seabiscuit,BasselDamra,"The nearest library","A Martian living on Earth, I tweet about a looooot of things.",NULL,406,2544,en,49,NULL
1038726899139325952,"@azuresupport #azTechHelp How are you supposed to diagnose 500 errors?  Just deployed a .NET 2.1 app and cannot access any meaningful logs on azure.","2018-09-09 09:52:46",0,0,0,0,en,827268863809040384,827268863809040384,"Jason Goemaat",JasonGoemaat,,,NULL,2,14,en,211,NULL
1038764843833028609,"@azuresupport #azTechHelp We wish to increase session timeout for ASP application which has hosted in Azure web app platform.  how could we achieve it?","2018-09-09 12:23:32",0,0,0,0,en,55483413,55483413,தமிழன்பன்,_thamizhanban,,,NULL,7,4,en,313,NULL
1038770064680513537,"@azuresupport #azTechHelp
I have Deployed the web on Azure and i have 2 images Folders in which user can upload images on it. 1st works fine but other one shows Exeption "Path not Found" after Deploying on azure . and even i create new folder and then deploy but it also dnt work","2018-09-09 12:44:17",0,0,0,0,en,334029251,334029251,"AHMAD MUSTAFA",Amodarling,GUJRAT,,NULL,9,33,en,25,NULL
1038773557659086848,"@azuresupport #azTechHelp
Is there any Method to see the files and folder after deploying web on azure ?","2018-09-09 12:58:10",0,0,0,0,en,334029251,334029251,"AHMAD MUSTAFA",Amodarling,GUJRAT,,NULL,9,33,en,313,NULL
1038817445253804033,"@gh_geek @ralph_squillace @AzureSupport @brunoborges @Azure @JakartaEE I should have mentioned you can reset the password in App Service Configuration. I’d also recommend using Service Principals for read-only (pull) access. Admin is a single user, demo account with push and pull rights.","2018-09-09 15:52:33",0,0,0,0,en,19380675,19380675,"Steve Lasker",SteveLasker,"Seattle WA, USA","@Microsoft, focusing on Container Experiences, PM for Azure Container Registry, Sailing/Racing, Climbing",https://t.co/IF78UwOuJS,701,877,en,317,NULL
1038821230290370560,"@AzureSupport @AzureSupport useless support don't trust their service for India if possible stop using. Start using @OracleCloud must be batter","2018-09-09 16:07:36",0,0,0,0,en,76093327,76093327,"Chirag Shah",chineel,,,NULL,12,113,en,310,NULL
1038827866643808256,"@AzureSupport Thank you!","2018-09-09 16:33:58",0,0,0,0,en,248722643,248722643,"Jim Holmes",aJimHolmes,"Ashland, OR","Single dad overcoming tragedy. I help fix communication, quality, and process problems. Wrote The Leadership Journey https://t.co/tZHvJKTIb0",http://t.co/8JwJzk6w1R,2494,1525,en,01,NULL
1038850789366751235,"@AzureSupport @Azure is there any use case to implement Split DNS in Azure DNS?","2018-09-09 18:05:03",0,0,0,0,en,875013348,875013348,"Amarendra Kumar",Amar0508,"New Delhi",,NULL,23,17,en,313,NULL
1038855221147922432,"@azuresupport I was wondering if hard disk storage of 20TB is available?","2018-09-09 18:22:40",0,0,0,0,en,889270812708003840,889270812708003840,"HARDCORE GAMES™",HardcoreGamestm,Canada,,https://t.co/D4jV2Ad5Kt,204,526,en,26,NULL
1038865582731526144,"@AzureSupport are there any best practices for this use case: client is unmanaged C++ application using Azure SignalR. 
There seems to be no Unmanaged C++ library for Azure SignalR. Any suggestions appreciated. Surely an easier way than .netcore dll -&gt; COM library?","2018-09-09 19:03:50",0,0,0,0,en,1027237985052446722,1027237985052446722,Peter,PeterCo05410153,"United Kingdom","Science & Technology",NULL,0,0,en,313,NULL
1039096610050007040,"@AzureSupport If i wanted to raise an issue with VSTS notifications not being received for one of my users, what would be the best way of raising a ticket for this?","2018-09-10 10:21:51",0,0,0,0,en,299913305,299913305,"Simon Osborne",WazzTheBadger,Worcester,"Lead Technology Architect at @BibbyFinanceUK. Father of three. Indie music fan, golf and cricket nut.",https://t.co/zJUoaZZ7nt,167,239,en,313,NULL
1039097554267525120,"@AzureSupport Yes working fine again","2018-09-10 10:25:37",0,0,0,0,en,101765193,101765193,"Aarjan Meirink",AarjanMeirink,"The Netherlands",,http://t.co/F7Hl6zGrb7,99,71,en,01,NULL
1039099976939450368,"@AzureSupport @VSTS Thanks, i subsequently raised a ticket through the support section of VSTS.","2018-09-10 10:35:14",0,0,0,0,en,299913305,299913305,"Simon Osborne",WazzTheBadger,Worcester,"Lead Technology Architect at @BibbyFinanceUK. Father of three. Indie music fan, golf and cricket nut.",https://t.co/zJUoaZZ7nt,167,239,en,316,NULL
1039109108375465984,"@AzureSupport Say you have 1 TB managed disc. How much Storage do we need to pay for With Azure Backup V2 (7 days snapshot stored locally?)","2018-09-10 11:11:31",0,0,0,0,en,14302095,14302095,"Frank Iversen",frankiversen,"Molde, Norway","it-consultant - addicted to virtualization (hyper-v, citrix, veeam) / songwriter and producer, MFK",https://t.co/05Lnl8RkYP,164,246,no,313,NULL
1039115933644517376,"@AzureSupport Thanks for the reply. I have go through this. But the problem is pipeline task does  not support for dbf file in data lake. 
If the file in local machine I can use Microsoft.Jet.OLEDB.4.0 connection to read the dbf. But in my case the file is in Data Lake.","2018-09-10 11:38:39",0,0,0,0,en,1039007686111592448,1039007686111592448,"Ruwan Sri Wickramarathna",RuwanSriWickra1,,,NULL,0,0,en,26,NULL
