id_tweet,text_tweet,created_at_status,truncated,retweet_count,favorite_count,retweeted,lang_status,id_user,id_str_user,name_user,screen_name_user,location_user,description_user,url_user,followers_count_user,favourites_count_user,lang_user,main_category,sub_category
1040084073580920832,"@AzureSupport I'm verifying Auzre DevOps functionality.
When creating Python project and going to repository, the following error is shown.

An unexpected error has occurred within this region of the page.
You can try reloading this component or refreshing the entire page.","2018-09-13 03:45:41",0,0,1,0,en,1040047487342399488,1040047487342399488,"Asato Takemoto",AsatoTakemoto,,,NULL,0,0,en,25,NULL
1040086900596330498,"Feature request for Application Insights - F5 key should run the query and not refresh the site thus losing your work. #dammit @AzureSupport","2018-09-13 03:56:55",0,0,0,0,en,995807779003617280,995807779003617280,"Peter Jim",PeterJimAU,Melbourne,"An account that I created to complain to cloud services about them not working correctly.",NULL,0,17,en,26,NULL
1040095983164477440,"@AzureSupport Just creating Python-Django Azure DevOps project according to https://t.co/NFvII7C8fy. After creating project successfully, I tried to access repository, but this error is shown and could not acccess it. https://t.co/Ifq3ZRsoNK","2018-09-13 04:33:01",0,0,1,0,en,1040047487342399488,1040047487342399488,"Asato Takemoto",AsatoTakemoto,,,NULL,0,0,en,25,NULL
1040096189117423616,"@AzureSupport I tried again during wait, however, same error happened again.","2018-09-13 04:33:50",0,0,0,0,en,1040047487342399488,1040047487342399488,"Asato Takemoto",AsatoTakemoto,,,NULL,0,0,en,25,NULL
1040097840343773184,"@AzureSupport How do  I get paid support again.
Free support is useless. My Sub id is 24a03dac-2255-4b7f-b133-3a6b808e606a","2018-09-13 04:40:23",0,0,0,0,en,34402115,34402115,TruthSayer,Gaelmart,Ireland,,NULL,12,156,en,015,NULL
1040101133811965952,"@AzureSupport Thank you for suggestion. I use twitter after a long time... I forgot a proper operation. =)","2018-09-13 04:53:29",0,0,0,0,en,1040047487342399488,1040047487342399488,"Asato Takemoto",AsatoTakemoto,,,NULL,0,0,en,01,NULL
1040106020427784193,"Five habits of highly effective Azure users https://t.co/xAzbKkz7rL #Azure #Cloud #MSIgnite #MVPbuzz Follow @Azure @AzureSupport https://t.co/kghbRjIbiJ","2018-09-13 05:12:54",0,1,2,0,en,89009369,89009369,"James van den Berg",JamesvandenBerg,"Noord-Holland, Laren","I'm a MVP CDM Cloud and DataCenter Management. #Azure #MSOMS #AzureStack #Sysctr #Hyperv #Winserv #DevOps Future Care.   My blogsite :",http://t.co/PJ94D0L68t,5710,6304,en,49,NULL
1040113605637820417,"@azuresupport #azhelp: plz why im charged for my free subscription, plz i want my money back","2018-09-13 05:43:02",0,0,0,0,en,2299460510,2299460510,"Hazim ",HazimQaQc,,,NULL,5,0,en,313,NULL
1040124012263866368,"@AzureSupport @rorywoods Is it possible to post this detailed report in a public spot as a post morten?","2018-09-13 06:24:23",0,0,0,0,en,285813213,285813213,"Stefan Reichel Ⓥ",bomret,Berlin,"Enthusiastic polyglot software developing geek with a passion for powerful, modern languages, asynchrony, distributed systems and reactive programming.",https://t.co/Zn7JVMBFUF,118,227,en,313,NULL
1040128555257085953,"@AzureSupport hello, i’m listening","2018-09-13 06:42:26",0,0,0,0,en,470529353,470529353,"Anonymous Tap",AnonymousTap,,,NULL,3,0,fr,49,NULL
1040134696191971328,"@PeterJimAU @AzureSupport I bet - no chances. Browsers don't like when site tries to take away their most precious Fx bindings. Some companies can solve it with hardware fixes like touch bar, so home users won't open devtools accidentally ;)","2018-09-13 07:06:50",0,0,0,0,en,44340663,44340663,"Alexey Shcherbak",centur,"Melbourne,Victoria, Australia",".NET developer and semi-bearder coder. Kicking code awesomeness for http://t.co/4tbbwHsWpq",http://t.co/NKUozBLQCZ,306,375,en,316,NULL
1040137032801157121,"@azuresupport #azTechHelp Transcription generated in Media Indexer is too short. I have 30 minutes long audio file, run indexing process multiple times and about 3 from 10 transcriptions is cut after 30 seconds. I can send test app I wrote to reproduce that problem.","2018-09-13 07:16:08",0,0,0,0,en,246800943,246800943,Mirek,mkrymski,"Rzeszów, Polska",,NULL,20,1,en,24,NULL
1040145377410789377,"@azuresupport #azTechHelp
 I purchased Office 365 Business license for 10 users before two days. They can't access thier online outlook or even via desktop application. it gives an error like something went wrong with OwaUserHasNoMailboxAndNoLicenseAssigned Exception.","2018-09-13 07:49:17",0,0,0,0,en,1040144918507794432,1040144918507794432,Ibrahim,Ibrahim75613074,,,NULL,2,0,en,25,NULL
1040160034645262337,"If you are trying to complete the initial configuration of a #LogAnalytics solution and nothing happens when you click the tile in the Azure portal, click the link which takes you to the old OMS portal. The tile works fine from there @Azure @AzureSupport","2018-09-13 08:47:32",0,0,0,0,en,882944515,882944515,Viruk,Viruk67,,"Way too old to be playing computer games",https://t.co/szpnDbHxbU,31,19,en,317,NULL
1040161345314992128,"@azuresupport #azTechHelp can someone help me with my web app, we are seeing a lot of Server cannot set status after HTTP headers have been sent errors.","2018-09-13 08:52:44",0,0,0,0,en,1011190591596658688,1011190591596658688,JohnBender1978,JBender1978,,,NULL,0,1,en,25,NULL
1040161750224646146,"Hey @AzureSupport, I don't see any subscriptions in my Azure portal. Is there something down?","2018-09-13 08:54:21",0,0,0,0,en,1373709889,1373709889,"Dr. Nestori Syynimaa",NestoriSyynimaa,"Tampere, Finland","PhD, CITP, and seasoned Enterprise Architect",http://t.co/WalvvD2rU8,123,121,en,13,NULL
1040162844581523456,"@AzureSupport Yes, and so have our other admins. Also some of our services are down so we're not able to start them.","2018-09-13 08:58:42",0,0,0,0,en,1373709889,1373709889,"Dr. Nestori Syynimaa",NestoriSyynimaa,"Tampere, Finland","PhD, CITP, and seasoned Enterprise Architect",http://t.co/WalvvD2rU8,123,121,en,25,NULL
1040169539571466241,"@AzureSupport any News on this?","2018-09-13 09:25:18",0,0,0,0,en,14302095,14302095,"Frank Iversen",frankiversen,"Molde, Norway","it-consultant - addicted to virtualization (hyper-v, citrix, veeam) / songwriter and producer, MFK",https://t.co/05Lnl8RkYP,164,246,no,211,NULL
1040175965631074305,"@AzureSupport thank you very much for the amazing, outstanding support! https://t.co/G0dbe2h4Ap","2018-09-13 09:50:50",0,0,0,0,en,462686289,462686289,"Bernhard Wurm",ItsRaupes,,"CEO Sales Suckers OG | We simply optimize your work, by valuating your time #sales",https://t.co/ReGQPeqH77,62,263,de,01,NULL
1040177061992824832,"@AzureSupport Thank you","2018-09-13 09:55:11",0,0,0,0,en,10598672,10598672,"Juan Quijano",jc_quijano,Madrid,"Renacentista en el hambre del conocimiento, ciudadano del mundo, escéptico, agnóstico, friki, super geek. Enamorado de la vida, mi pareja, y mi profesión.",https://t.co/Oj0OSCDEaL,1091,2533,es,01,NULL
1040178259298791424,"@AzureSupport smart contract deployment on blockchain workbench doesn't work, though I uploaded the contract successfully. https://t.co/yQZNhpopp1","2018-09-13 09:59:57",0,0,0,0,en,2844053064,2844053064,"Gauthier Petetin",GPetetin,,,NULL,31,57,fr,25,NULL
1040178401519316992,"@azuresupport I’m at #prognet conference London and unable to add a trial or pay-as-you-go subscription to my account - it says I am not eligible! Ticket id: 118091318999282","2018-09-13 10:00:31",0,0,1,0,en,125457347,125457347,"Tim Williams",tim_wllms,"London, England","Work hard and be nice to people.

Building APIs, visualising data and drinking coffee with TfL via BAE Systems",NULL,97,97,en,25,NULL
1040178767266766848,"@AzureSupport Thank you for your quick reply. Yes I am the administrator.","2018-09-13 10:01:58",0,0,0,0,en,2844053064,2844053064,"Gauthier Petetin",GPetetin,,,NULL,31,57,fr,01,NULL
1040179304611622912,"@azuresupport #azTechHelp I am unable to log into vsts since attempting to link with azure ad. Can you help with this?","2018-09-13 10:04:06",0,0,0,0,en,1430449507,1430449507,"David Fowle",foldedwave,UK,,http://t.co/Jyz02hcrJe,10,1,en,25,NULL
1040179620010749952,"@AzureSupport Using Kudu on (Windows) App Service -&gt; Process Explorer -&gt; My .NET Core app -&gt; Download memory dump. Gives 500 error, "Only part of a ReadProcessMemory or WriteProcessMemory request was completed". Any tips?","2018-09-13 10:05:21",0,0,0,0,en,47887958,47887958,"Kieren Johnstone",kierenjohnstone,"Horsham, West Sussex","https://t.co/YmpmXH3qsd - https://t.co/CGbAUi1QeP",NULL,129,1289,en,25,NULL
1040183112536387585,"@AzureSupport Thanks :) Have posted, https://t.co/yUMNLHTm0r","2018-09-13 10:19:14",0,0,0,0,en,47887958,47887958,"Kieren Johnstone",kierenjohnstone,"Horsham, West Sussex","https://t.co/YmpmXH3qsd - https://t.co/CGbAUi1QeP",NULL,129,1289,en,01,NULL
1040190746404564992,"@AzureSupport Hey guys - I fixed this by uninstalling .NET 4.7.2 and reinstalling it. Seems to have fixed the high CPU usage and azure ad connect services. Cheers!","2018-09-13 10:49:34",0,0,0,0,en,243747596,243747596,Yacobson,cjtheway,,"Job = System Administrator / Passions = Infosec, Chelsea FC, MMA",NULL,255,10986,en,317,NULL
1040193243974180866,"@azuresupport #azTechHelp Azure backup won't register. I thought the microsoft ecosystem should give a better error than, please try later. Please help","2018-09-13 10:59:29",0,0,0,0,en,130514659,130514659,"Andy Wright",AndyWright79,Oldham,"I have five loves in my life, my wife, my daughter, my 2 sons and City. Also a bit of a geek.",NULL,130,188,en,25,NULL
1040194923872563200,"@AzureSupport Thanks an engineer called me… apparently this requires remoting into my machine to see a screenshot of the error message! I’m sorry but for obvious security reasons I feel this is completely unnecessary to resolve an account issue.","2018-09-13 11:06:10",0,0,0,0,en,125457347,125457347,"Tim Williams",tim_wllms,"London, England","Work hard and be nice to people.

Building APIs, visualising data and drinking coffee with TfL via BAE Systems",NULL,97,97,en,25,NULL
1040205303571206145,"@AzureSupport No I have no other error message. I retried multiple times (always by following the official documentation), with smart contracts from the official Microsoft repo, but I always get this same error.","2018-09-13 11:47:25",0,0,0,0,en,2844053064,2844053064,"Gauthier Petetin",GPetetin,,,NULL,31,57,fr,25,NULL
1040209664984707072,"@AzureSupport Hello, is there a way to get the details of a request from a device to the IoT hub? I can see successful requests on the IoT dashboard but I don't see how I can check the contents of the requests coming in from the devices. Thank you in advance.","2018-09-13 12:04:44",0,0,0,0,en,1362370022,1362370022,"Jeremiah Bryant",jbryant06,,,NULL,53,3227,en,313,NULL
1040213426226769920,"Hello @AzureSupport,

What need to be entered as name of parameter AD CONNECTOR NAME and AZURE AD CONNECTOR NAME? Server name / Tenant name or something other?

https://t.co/lYGGigzKpi

Thanks,","2018-09-13 12:19:41",0,0,0,0,en,2589184304,2589184304,"Vladimir Stefanović",vladimir_MCT,Belgrade,"System Engineer, Tech Trainer, Microsoft specialist, Speaker",https://t.co/e7SEwLaa7r,93,183,en,313,NULL
1040213432992256001,"@AzureSupport So is there any painless way to move an entire classic blob storage account to a different region?","2018-09-13 12:19:43",0,0,0,0,en,36465658,36465658,"Kyle Weishaupt",kyleweishaupt,"Detroit, MI","web developer, network administrator, internet magician.",NULL,160,4007,en,313,NULL
1040214331298852869,"@AzureSupport Thank you very much, this looks promising","2018-09-13 12:23:17",0,0,0,0,en,1362370022,1362370022,"Jeremiah Bryant",jbryant06,,,NULL,53,3227,en,01,NULL
1040221224192880640,"@AzureSupport any update on this, can you access my account and see what is causing this","2018-09-13 12:50:40",0,0,0,0,en,1603800122,1603800122,"RAM CHOPPA",RAMCHOPPA,,,NULL,1,0,en,211,NULL
1040224190304006144,"@azuresupport #azTechHelp HI, I can't delete a storage Account(classic). i am being charged and i am not using. Thanks in advance","2018-09-13 13:02:28",0,0,0,0,en,849103555,849103555,"Rifa Khoder",Rifa_khoder,Beirut,"Mother, doer, fast learner, problem solver, Quality and Process improvement, Automation  .... Animal Lover....",https://t.co/NvBKuh6Kv4,153,129,en,25,NULL
1040225068482277377,"@jgaylord Sorry to hear that, Jason! @AzureSupport can have a look at that issue. Thanks!","2018-09-13 13:05:57",0,0,0,0,en,17000457,17000457,"Microsoft Azure",Azure,"Redmond, WA","The official account for Microsoft Azure. Follow for news and updates from the #Azure team and community. For help, please contact @AzureSupport.",http://t.co/vFtkLITsAX,628552,4673,en,25,NULL
1040245157336100864,"@azuresupport #azTechHelp  Azure Access control was support was to drop in November, but today my web app under ACS is down saying it can't find the ACS service.  I restarted it and tried to AAD authenticate but can't save with Internal error.","2018-09-13 14:25:46",0,0,0,0,en,41688613,41688613,CyberPine,cyberpine,"Dania Beach, FL","CyberPine Educational Media",http://t.co/zIZ7Aeh52O,1,0,en,25,NULL
1040246809426321408,"How long it usually take @AzureSupport tech to respond on Azure support portal tickets? I have seen ticket to be assigned to 3 different tech, one question set what I responded. Ticket is opened on Monday. #azure #support","2018-09-13 14:32:20",0,0,0,0,en,932320743295193088,932320743295193088,"Jesse Lahtela",JesseLahtela,"Varsinais-Suomi, Suomi","Tech and music... challenging old ways of thinking... that’s me!",https://t.co/GRR9WwMjne,53,793,fi,214,NULL
1040248916124598275,"@AzureSupport Sure... here you go: 118090818963710 mostly me sending info to Azure support techs. Bit lonely ticket ;)","2018-09-13 14:40:43",0,0,0,0,en,932320743295193088,932320743295193088,"Jesse Lahtela",JesseLahtela,"Varsinais-Suomi, Suomi","Tech and music... challenging old ways of thinking... that’s me!",https://t.co/GRR9WwMjne,53,793,fi,316,NULL
1040249841031376902,"@AzureSupport AML Workbench worked fine till yesterday and today while submitting a python script its keeping on Submitting state . I tried removing the Experimentation Account and its saying dependency not deleted error. #AzureMLWB . Not sure why its having so many issues.","2018-09-13 14:44:23",0,0,0,0,en,151720516,151720516,sashank,sashankpappu,Hyderabad,Personal,NULL,89,173,en,25,NULL
1040251245376798721,"@AzureSupport You on @Twitter #AzureSupport are awesome! Hope we get it fast resolved... our BI team is getting frustrated.","2018-09-13 14:49:58",0,0,0,0,en,932320743295193088,932320743295193088,"Jesse Lahtela",JesseLahtela,"Varsinais-Suomi, Suomi","Tech and music... challenging old ways of thinking... that’s me!",https://t.co/GRR9WwMjne,53,793,fi,01,NULL
1040252674237718528,"Hey @AzureSupport,

What would be the best way to protect my Azure App Services from DDOS attacks?
I was looking at Azure DDoS Protection but it seems like it does not protect App Services. The other solution that came to my mind was application gateway web application firewall.","2018-09-13 14:55:39",0,0,0,0,en,1013739426470653953,1013739426470653953,"Asad Khan",HeyAsadKhan,,,NULL,5,0,en,313,NULL
1040254707862790144,"@azuresupport #azTechHelp Why would my database export job wont start? IT has been on accepted status for over 2 hours now?","2018-09-13 15:03:44",0,0,0,0,en,416369686,416369686,"Alejandro Gonzalez",alejoviejo1981,,,NULL,29,6,en,25,NULL
1040256682700492800,"@AzureSupport Yes it was. After reading online forum, I got the impression that Azure DDOS Protection will not protect app services and may be i should look into Azure Application Gateway for App Services.","2018-09-13 15:11:34",0,0,0,0,en,1013739426470653953,1013739426470653953,"Asad Khan",HeyAsadKhan,,,NULL,5,0,en,24,NULL
1040257658509553666,"@AzureSupport Are they any issues with Graph API authentication in the UK? Some of our customers are reporting problems authenticating","2018-09-13 15:15:27",0,0,0,0,en,46079330,46079330,"Phil Clare",philotelli,Manchester,"Married to the lovely Emma, 3 brilliant kids, City fan and Christian, though not necessarily in that order.",NULL,300,175,en,25,NULL
1040258325819080705,"@AzureSupport Only error message we're seeing is an invalid skiptoken, but this has been working for quite some time (including yesterday) until today","2018-09-13 15:18:06",0,0,0,0,en,46079330,46079330,"Phil Clare",philotelli,Manchester,"Married to the lovely Emma, 3 brilliant kids, City fan and Christian, though not necessarily in that order.",NULL,300,175,en,25,NULL
1040259070429745153,"@AzureSupport Only happening in the EU as well, US users are not experiencing the same issue","2018-09-13 15:21:04",0,0,0,0,en,46079330,46079330,"Phil Clare",philotelli,Manchester,"Married to the lovely Emma, 3 brilliant kids, City fan and Christian, though not necessarily in that order.",NULL,300,175,en,25,NULL
1040260618517966849,"@AzureSupport Brilliant! Thank you","2018-09-13 15:27:13",0,0,0,0,en,1013739426470653953,1013739426470653953,"Asad Khan",HeyAsadKhan,,,NULL,5,0,en,01,NULL
1040263245221781504,"@azuresupport Is it possible to disable client side dependency tracking, i.e. javascript requests","2018-09-13 15:37:39",0,0,0,0,en,3247001,3247001,"James Coverdale",cadab,Leeds,"I'm James, thats it.",NULL,160,636,en,26,NULL
1040263750400581632,"@AzureSupport Hello, what can I do? I'm listening","2018-09-13 15:39:39",0,0,0,0,en,1582715804,1582715804,"Philippe Delvigne",PhilippeDelvign,,,NULL,9,46,fr,49,NULL
1040264296901619712,"I chose the wrong location for myrecoveryservicesvault and need to change it. How do I do this?

@azuresupport #azTechHelp","2018-09-13 15:41:50",0,0,0,0,en,2761523379,2761523379,"Michael Gaito",OfficialGaito,"Saw Creek, PA","IT Support Specialist, living the dream.",https://t.co/x7bt6jg6PO,2,2,en,313,NULL
1040265617557921794,"@AzureSupport are release annotations going away from #AppInsights? It seems to be getting less and less visible lately and it's pretty frustrating.","2018-09-13 15:47:05",0,0,0,0,en,14923916,14923916,Nick,Izzmo,"Lenexa, KS","Creating, managing, and accelerating continuously delivered applications. @Valorem #SoftwareDeveloper, #ComputerEngineer.",http://t.co/0IWoZrXz2L,402,3333,en,214,NULL
1040268458120937473,"@AzureSupport @WebAdvex Yes pls","2018-09-13 15:58:22",0,0,0,0,en,438012495,438012495,"Raj Krishnan",gajarajakrishna,"San Francisco, CA","CTO,InfraACE Technologies, Raj Krishnan is the Leading Architect in Enterprise Virtualization and Cloud Computing space.",https://t.co/SjgaXMbLn8,408,3327,en,49,NULL
1040268595136262144,"@AzureSupport #AzureSearch Any one knows why the offset of my normalized_images are always at the end of my document? although the [image] tag is not at the end at all. #Help #Azure","2018-09-13 15:58:54",0,0,0,0,en,1573615255,1573615255,"Sammy Deprez",sammydeprez,"Ghent, Belgium","Father of 2, Passionate about #data and #AI",https://t.co/8e5O5Pk8jk,203,490,en,313,NULL
1040272436959301632,"@AzureSupport do i need Azure AD premium to add AD apps from Gallery ?","2018-09-13 16:14:10",0,0,0,0,en,67712697,67712697,"Exterminate !!!",desidalek,"Out, living my life","Living life! One weekend at a time",https://t.co/d191n5ab9a,819,1566,en,313,NULL
1040274557985337345,"@AzureSupport Why do I have to request refunds for SLA's that you break. Should this not be automatic especially serious periods of downtime?","2018-09-13 16:22:36",0,0,0,0,en,14557688,14557688,red_square,red_square,,"vp software @ ivendi, es, cqrs, ddd, iHandleCommands",NULL,800,3614,en,26,NULL
1040274811824611328,"@AzureSupport @azuread @vfzec both of us?","2018-09-13 16:23:37",0,0,0,0,en,257731625,257731625,"Michael M. Thornberg",MMThornberg,"Copenhagen, Denmark
","I do distributed web dev, architecture and management + general IT stuff ❤️ #Azure + #VSTS ☁️ Father of three 👨‍👦‍👦👩‍👧 #DoYourJob #NoDaysOff",NULL,241,6356,en,49,NULL
1040275243565297666,"@AzureSupport Hi, I am unable to create/delete CosmosDB in the portal. After creating a new one, I am getting this... even though all VNets are allowed with access. https://t.co/1BOAjMXdaC","2018-09-13 16:25:20",0,0,0,0,en,1124095932,1124095932,"Pranav V Jituri",Blueelvis_RoXXX,"Faridabad, Haryana, India","Passionate Debugger. MCP in Server Virtualization, MCP In Implementing Azure Solutions. Microsoft Student Partner. Aspiring to learn more ^_^",http://t.co/eCRuhykJDT,196,233,en,25,NULL
1040275468790915072,"@AzureSupport I am an co-owner and i cant add new applications.

What permission do i need to do this ? https://t.co/W3TjUjczWs","2018-09-13 16:26:13",0,0,0,0,en,67712697,67712697,"Exterminate !!!",desidalek,"Out, living my life","Living life! One weekend at a time",https://t.co/d191n5ab9a,819,1566,en,313,NULL
1040275529365159936,"@AzureSupport Thanks for the reply, I think I was looking for this document - https://t.co/hvgyabZApY Which outlines what level of management you per version of @Windows. #intune","2018-09-13 16:26:28",0,0,0,0,en,52452928,52452928,"Jason Miller",JasonKMiller,"San Francisco","I speak my mind whether you like it or not.",http://t.co/BUM7Xtqrae,179,248,en,211,NULL
1040276274156060672,"@AzureSupport @AzureCosmosDB Is there any incident going on with the portal or with resources in East US? I see other tweets where you mention that there is something going on. Could you please tell me what's up?","2018-09-13 16:29:25",0,0,0,0,en,1124095932,1124095932,"Pranav V Jituri",Blueelvis_RoXXX,"Faridabad, Haryana, India","Passionate Debugger. MCP in Server Virtualization, MCP In Implementing Azure Solutions. Microsoft Student Partner. Aspiring to learn more ^_^",http://t.co/eCRuhykJDT,196,233,en,211,NULL
1040277296358146048,"@AzureSupport Okay it seems to be working now... Thanks! Maybe a hiccup?","2018-09-13 16:33:29",0,0,0,0,en,1124095932,1124095932,"Pranav V Jituri",Blueelvis_RoXXX,"Faridabad, Haryana, India","Passionate Debugger. MCP in Server Virtualization, MCP In Implementing Azure Solutions. Microsoft Student Partner. Aspiring to learn more ^_^",http://t.co/eCRuhykJDT,196,233,en,01,NULL
1040277706234109952,"3rd tweet. @AWSSupport want a response and I don't want to see "move to different tier" - You are severely throttling machines now, they are barely usable.

@GoogleCloud_UKI @AzureSupport - do you throttle machines cpu? if not im moving to you. https://t.co/3jwl0B96XM","2018-09-13 16:35:07",0,0,0,0,en,937430535386824710,937430535386824710,"Adam Voulstaker",adamvoulstaker,London,"Realist.

offended that you're offended",https://t.co/xL7e4hsqtM,106,2986,en,25,NULL
1040279200693858304,"@AzureSupport Have asked a question here
https://t.co/UkGRFMZbz7","2018-09-13 16:41:03",0,0,0,0,en,67712697,67712697,"Exterminate !!!",desidalek,"Out, living my life","Living life! One weekend at a time",https://t.co/d191n5ab9a,819,1566,en,313,NULL
1040284573387481088,"@AzureSupport tried with other account also its the same /...","2018-09-13 17:02:24",0,0,0,0,en,151720516,151720516,sashank,sashankpappu,Hyderabad,Personal,NULL,89,173,en,49,NULL
1040286661274423301,"@NestoriSyynimaa @AzureSupport Nestori - can you brief us?","2018-09-13 17:10:42",0,0,0,0,en,217919145,217919145,"Roope OFFICIAL",roland_reagan,Helsinki,"Kaksijalkainen, yksipäinen; Humanoidi",https://t.co/zQgaFZpY9H,226,964,fi,211,NULL
1040290434738806789,"Top Accounts to Follow for @Microsoft  @Azure via @AzureSteveMVP &gt;&gt;
@azureadvocates 
@ch9
@MSCloud 
@AzurePortal 
@azurefriday 
@AzureFunctions 
@AzureBackup 
@MSAzureCAT 
@AzureCosmosDB 
@AzureDevOps 
@AzureDBMySQL 
@AzureMktPlace 
@AzureSupport 
@AzureWeekly","2018-09-13 17:25:41",0,19,37,0,en,1029781068742832128,1029781068742832128,"Azure Steve ⛅",AzureSteveMVP,"Atlanta, GA","Consultant Speaker Trainer | @Microsoft @Azure #MVP | #Top50 #IoT | #Futurist #BlockChain #Agile #DevOps #UX #CX #AI #BigData #ML #DataScience #CyberSecurity",https://t.co/guOD2rco1E,81,27,en,49,NULL
1040292766402715648,"@AzureSteveMVP @AzureCosmosDB @Microsoft @Azure @azureadvocates @ch9 @MSCloud @AzurePortal @azurefriday @AzureFunctions @AzureBackup @MSAzureCAT @AzureDevOps @AzureDBMySQL @AzureMktPlace @AzureSupport @AzureWeekly Sorry but I think you forgot about mine! 🤔🤣","2018-09-13 17:34:57",0,0,1,0,en,39459635,39459635,"Juan Carlos Andreu",andreujuanc,,"Software Architect, Platform Developer, Wannabe Music Producer, Coffee connoisseur. I often reply with gifs. 

Opinions are my own.",https://t.co/OTIP8sGuX1,255,2869,en,49,NULL
1040295430192603136,"@AzureSupport Hey again, I'm *still* waiting for a response on this ticket. It's making it impossible to continue forward with development on our application and I'm not really sure what to do at this point.","2018-09-13 17:45:32",0,0,0,0,en,63878170,63878170,"Elmir Kouliev",elmirkouliev,"New York, NY",,https://t.co/jFxFx2UMNd,171,1755,en,214,NULL
1040297801148653568,"@azuresupport #azhelp: Hello I would like to know if it is possible to have an automatic backup of my Azure database called from my system if not, exist any automatic politics of back up? if yes how could I access my back up in case of emergency for example?","2018-09-13 17:54:58",0,0,0,0,en,827901007757770752,827901007757770752,"Lincoln C. de Faria",lincoln_cf,,,NULL,5,0,en,26,NULL
1040300379064414209,"@azuresupport #azhelp:What is the best way to develop "Flask on Linux" by PTVS locally?","2018-09-13 18:05:12",0,0,0,0,en,475222993,475222993,"Aakash Shah",aadiaakash,"Arlington, VA","An avid reader and endowed by the creator with unalienable rights to express my thoughts.",https://t.co/kXkB87ts33,290,1556,en,313,NULL
